Level code,University,City,Courses,Faculty,Int fees,Local fees,Currency,Currency Time,Duration,Duration Time,Prerequiste_1,Prerequiste_2,Prerequiste_3,Prerequiste_1_grade,Prerequiste_2_grade,Prerequiste_3_grade,Website,course_lang,Availability,Description,Career outcomes,Country,Online,Offline,Distance,Face to face,Blended,Remarks,Course delivery mode,Free TAFE
DIP,TAFE SA,Regency Park,Diploma of Counselling,Community Services,"$11,500",,AUD,Year,18,Months,,,,,,,https://www.tafesa.edu.au/xml/course/aw/aw_TP00941.aspx?S=AWD&Y=2021,English,A,This course offers a practical and theoretical foundation for effective counselling. It will equip students with counselling skills for effective interactions with clients.,"Support worker, problem gambling worker, family liaison worker.",Australia,Yes,Yes,,Yes,Yes,"
Completion of the Core Skills Profile for Adults (CSPA)
",Normal,No
BA,TAFE SA,Regency Park,Diploma of Counselling/Bachelor of Arts - Uni of Adelaide Pathway,Community Services,"$7,910 -
                          $7,980",,AUD,Year,,Months,,,,,,,https://www.tafesa.edu.au/xml/course/aw/aw_DP10224.aspx?S=AWD&Y=2021,English,A,This course offers a practical and theoretical foundation for effective counselling. It will equip students with counselling skills for effective interactions with clients in either an agency or private practice.,"Support worker, problem gambling worker, family liaison worker.",Australia,Yes,Yes,,Yes,Yes,"
Completion of the Core Skills Profile for Adults (CSPA)
",Normal,No
BA,TAFE SA,Regency Park,Diploma of Counselling/Bachelor of Social Sciences - Uni of Adelaide Pathway,Community Services,"$7,910 -
                          $7,980",,AUD,Year,,Months,,,,,,,https://www.tafesa.edu.au/xml/course/aw/aw_DP10225.aspx?S=AWD&Y=2021,English,A,This course offers a practical and theoretical foundation for effective counselling. It will equip students with counselling skills for effective interactions with clients in either an agency or private practice.,"Support worker, problem gambling worker, family liaison worker.",Australia,Yes,Yes,,Yes,Yes,"
Completion of the Core Skills Profile for Adults (CSPA)
",Normal,No
DIP,TAFE SA,Adelaide City,Diploma of Financial Counselling,Community Services,"$7,526 -
                          $8,613",,AUD,Year,24,Months,,,,,,,https://www.tafesa.edu.au/xml/course/aw/aw_TP00942.aspx?S=AWD&Y=2021,English,A,"Gain the skills and knowledge to be able to deliver a specialist service within the community services sector. This course will provide you with specialist knowledge, paralegal skills and competencies focusing on credit and debt issues affecting clients and their rights and obligations. It provides a solid understanding of social and systemic issues that impact on financial counselling clients.","Job role titles may include: Financial Counsellor, Senior Financial Counsellor, Rural Financial Counsellor.
This qualification applies to financial counselling, which is a specialist service assisting people faced with debt and other financial issues. This work requires specialist knowledge, paralegal skills and competencies especially in regard to credit and debt issues affecting clients and their rights and obligations as well as solid understanding of social and systemic issues that impact on financial counselling clients. It may be applied in casework, community development and social justice contexts.
NOTE:
· This qualification is NOT related to the work performed by financial planners or financial advisors whose role is to provide clients with strategies to address their investment options.
· This qualification does NOT refer to therapeutic counselling. 
· Psychological issues, which affect individuals, families and groups such as gambling, substance abuse, child abuse, and mental or physical health problems require referral to a professionally qualified practitioner. However, a recognition of, and an ability to work within, a counselling framework on the way in which other issues may interact with personal financial issues is highly relevant to financial counselling practice.",Australia,Yes,Yes,,Yes,Yes,You must be working in a related industry and will be required to provide evidence of this before an offer is made,Normal,No
ADIP,TAFE SA,Mount Barker,Advanced Diploma of Community Sector Management,Community Services,"$4,876 -
                          $5,883",,AUD,Year,48,Months,,,,,,,https://www.tafesa.edu.au/xml/course/aw/aw_TP00826.aspx?S=AWD&Y=2021,English,A,"This course provides knowledge and skills in the areas of human resources, risk management, innovation, volunteer management, financial management, leadership, strategic planning and more, depending on the electives that you choose. In small group learning environments you will work alongside other community service leaders and share stories from your own experiences. All assessments are work-based and support you in developing staff and teams within your organisation.",Occupational titles may include: Centre Manager; Coordinator (large organisation; Community care manager; Manager (small agency/service); Community development manager; Program area manager; Community education manager; Project manager; Community services manager; Volunteer program manager.,Australia,Yes,Yes,,Yes,Yes,You must be working in a related industry and will be required to provide evidence of this before an offer is made,Normal,No
ADIP,TAFE SA,Mount Barker,Advanced Diploma of Community Sector Management/Bachelor of Arts - Uni of Adelaide Pathway,Community Services,"$4,830 -
                          $5,828",,AUD,Year,,Months,,,,,,,https://www.tafesa.edu.au/xml/course/aw/aw_DP10236.aspx?S=AWD&Y=2021,English,A,"This course provides knowledge and skills in the areas of human resources, risk management, innovation, volunteer management, financial management, leadership, strategic planning and more, depending on the electives that you choose. In small group learning environments you will work alongside other community service leaders and share stories from your own experiences. All assessments are work-based and support you in developing staff and teams within your organisation.",Occupational titles may include: Centre Manager; Coordinator (large organisation; Community care manager; Manager (small agency/service); Community development manager; Program area manager; Community education manager; Project manager; Community services manager; Volunteer program manager.,Australia,Yes,Yes,,Yes,Yes,You must be working in a related industry and will be required to provide evidence of this before an offer is made,Normal,No
ADIP,TAFE SA,Mount Barker,Advanced Diploma of Community Sector Management/Bachelor of Social Sciences - Uni of Adelaide Pathway,Community Services,"$4,830 -
                          $5,828",,AUD,Year,,Months,,,,,,,https://www.tafesa.edu.au/xml/course/aw/aw_DP10237.aspx?S=AWD&Y=2021,English,A,"This course provides knowledge and skills in the areas of human resources, risk management, innovation, volunteer management, financial management, leadership, strategic planning and more, depending on the electives that you choose. In small group learning environments you will work alongside other community service leaders and share stories from your own experiences. All assessments are work-based and support you in developing staff and teams within your organisation.",Occupational titles may include: Centre Manager; Coordinator (large organisation; Community care manager; Manager (small agency/service); Community development manager; Program area manager; Community education manager; Project manager; Community services manager; Volunteer program manager.,Australia,Yes,Yes,,Yes,Yes,You must be working in a related industry and will be required to provide evidence of this before an offer is made,Normal,No
CERTI,TAFE SA,,Certificate IV in Community Services,Community Services,,,AUD,Year,,Months,,,,,,,https://www.tafesa.edu.au/xml/course/aw/aw_TP00825.aspx?S=INT&Y=2021,English,A,"Develop the skills and knowledge to design and deliver person-centred services to individuals and/or groups as well as providing support, advocacy or interventions to individual clients, groups or communities across a range of services.","On completion of this qualification, students may be able to move into the community services sector, working in roles such as case worker, prevention worker, home based care worker, community services worker, welfare worker and early intervention worker.",Australia,Yes,Yes,,Yes,Yes,,Normal,No
DIP,TAFE SA,,Diploma of Community Services (Case Management),Community Services,,,AUD,Year,,Months,,,,,,,https://www.tafesa.edu.au/xml/course/aw/aw_TP00833.aspx?S=INT&Y=2021,English,A,"Students gain the expertise and knowledge necessary to facilitate case management, assess and analyse client needs, communicate effectively with clients and staff, and support client self-management.","Case worker, case coordinator, case manager.",Australia,Yes,Yes,,Yes,Yes,,Normal,No
CERTII,TAFE SA,External,Certificate II in Community Services,Community Services,"
",,AUD,Year,5,Months,,,,,,,https://www.tafesa.edu.au/xml/course/aw/aw_TP00823.aspx?S=ATSI&Y=2021,English,A,This course introduces you to general skills for working in the community services sector with a focus on developing skills in a variety of industry and residential settings.,"This qualification may be used as a pathway qualification into community services work and a number of Community Services & Health courses at Certificate III level. It may apply specifically to workers who support individuals by providing a first point of contact in a crisis situation and referral to a broad range of services, or workers in residential facilities and/or in community services under direct or regular supervision within clearly defined organisation guidelines and service plans.",Australia,Yes,Yes,,Yes,Yes,"

Help with Fees






              
                  Upfront Payment
                

Each semester, fees can be paid online with VISA or Mastercard or at an Australia Post outlet. 


                      Read More
                    






              
                  Payment Plan
                

 If you have difficulty paying your fees upfront, you may be eligible for a payment plan.


                      Read More
                    





",Normal,No
CERTIII,TAFE SA,"

Blended – learn in a mixture of classroom and online environments. On campus learning will be scheduled but online learning can provide more flexibility. Lecturer support will be provided for all study. Access to a computer with an internet connection is required.
",Certificate III in Community Services,Community Services,"
",,AUD,Year,6,Months,,,,,,,https://www.tafesa.edu.au/xml/course/aw/aw_TP00824.aspx?S=ATSI&Y=2021,English,A,Training that will equip you to become a community services workers who supports individuals through providing person-centred services within community settings and supporting the implementation of specific community-based programs.,"This course will increase employment options within the community services industry. It will also provide pathways to further studies in community services, aged care, disability work, mental health, drug education, nursing, youth work and more. Case worker, prevention worker, home based care worker, community services worker, welfare worker, early intervention worker.",Australia,Yes,Yes,,Yes,Yes,"Important Information



This qualification requires a combination of online study and compulsory weekly attendance on campus of up to two days per week.
For continuing studies in this qualification and for work in the sector, students will be required to obtain a clearance from the Department of Communities and Social Inclusion at their own expense. For more information please go to https://screening.dcsi.sa.gov.au/
Basic computing skills are required for successful completion of this course.  Contact Information Services on 1800 882 661 for information on courses available.
Reading, writing and numeracy skills are assessed using the Core Skills Profile for Adults (CSPA). This assessment is used to determine whether you will be required to undertake additional support units alongside your qualification or undertake a pathway course before commencing your chosen qualification. If you receive an offer, more information will be provided at your enrolment session.",Normal,No
CERTI,TAFE SA,Regency Park,Certificate IV in Mental Health,Community Services,"$3,520 -
                          $4,026",,AUD,Year,18,Months,,,,,,,https://www.tafesa.edu.au/xml/course/aw/aw_TP00828.aspx?S=AWD&Y=2021,English,A,"This course will equip you to provide a range of community services focusing on rehabilitation and support for people affected by mental illness and psychiatric disability. 
This involves promoting mental health wellness and recovery and delivering community-based activities that focus on mental health, mental illness and psychiatric disability.","This qualification reflects the role of workers who provide self-directed recovery oriented support for people affected by mental illness and psychiatric disability. Work involves implementing community based programs and activities focusing on mental health, mental illness and psychiatric disability. Work is undertaken in a range of community contexts such as community based non-government organisations, home based outreach, centre-based programs, respite care, residential services, rehabilitation programs, clinical settings, or supporting people in employment. Work is carried out autonomously under the broad guidance of other practitioners and professionals.",Australia,Yes,Yes,,Yes,Yes,"

            Completion of the Core Skills Profile for Adults (CSPA)
          
",Normal,No
CERTI,TAFE SA,Adelaide City,Certificate IV in Mental Health Peer Work,Community Services,"$3,146 -
                          $3,564",,AUD,Year,18,Months,,,,,,,https://www.tafesa.edu.au/xml/course/aw/aw_TP01024.aspx?S=AWD&Y=2021,English,A,This qualification reflects the role of workers who have experienced mental illness as either a consumer or carer and who work in mental health services in roles that support consumer peers or carer peers.,"Peer support workers are employed in the mental health sector in government, public, private or community managed services.",Australia,Yes,Yes,,Yes,Yes,Experience of mental illness as either a consumer or carer. You will be contacted to verify this before an offer is made,Normal,No
DIP,TAFE SA,Elizabeth,Diploma of Mental Health,Community Services,"$7,844",,AUD,Year,24,Months,,,,,,,https://www.tafesa.edu.au/xml/course/aw/aw_TP00829.aspx?S=AWD&Y=2021,English,A,"Learn the specialised skills and knowledge needed to provide services to clients in relation to mental health issues. This includes counselling, referral, advocacy and education/health promotion services and requires high level specialist knowledge, skills and competencies especially regarding laws affecting clients, the range of services available to them and health issues related to mental health.","Mental health community worker, mental health outreach worker, mental health rehabilitation worker, mental health support worker, alcohol and other drugs worker, community rehabilitation and support worker, community support worker.",Australia,Yes,Yes,,Yes,Yes,"

            Completion of the Core Skills Profile for Adults (CSPA)
          
",Normal,No
BA,TAFE SA,Elizabeth,Diploma of Mental Health/Bachelor of Arts - Uni of Adelaide Pathway,Community Services,"$7,770",,AUD,Year,,Months,,,,,,,https://www.tafesa.edu.au/xml/course/aw/aw_DP10234.aspx?S=AWD&Y=2021,English,A,"Learn the skills to provide services to clients in relation to mental health issues. This includes counselling, referral, advocacy and education/health promotion services and requires high level specialist
knowledge, skills and competencies especially regarding laws affecting clients, the range of services available to them and health issues related to mental health.","Mental health community worker, mental health outreach worker, mental health rehabilitation worker, mental health support worker, alcohol and other drugs worker, community rehabilitation and support worker, community support worker.",Australia,Yes,Yes,,Yes,Yes,Certificate IV or higher in a Community Services or Health related area,Normal,No
BA,TAFE SA,Elizabeth,Diploma of Mental Health/Bachelor of Social Sciences - Uni of Adelaide Pathway,Community Services,"$7,770",,AUD,Year,,Months,,,,,,,https://www.tafesa.edu.au/xml/course/aw/aw_DP10235.aspx?S=AWD&Y=2021,English,A,"Learn the skills to provide services to clients in relation to mental health issues. This includes counselling, referral, advocacy and education/health promotion services and requires high level specialist
knowledge, skills and competencies especially regarding laws affecting clients, the range of services available to them and health issues related to mental health.","Mental health community worker, mental health outreach worker, mental health rehabilitation worker, mental health support worker, alcohol and other drugs worker, community rehabilitation and support worker, community support worker.",Australia,Yes,Yes,,Yes,Yes,Certificate IV or higher in a Community Services or Health related area,Normal,No
CERTI,TAFE SA,Elizabeth,Certificate IV in Youth Work,Community Services,"$6,098 -
                          $7,245",,AUD,Year,18,Months,,,,,,,https://www.tafesa.edu.au/xml/course/aw/aw_TP00644.aspx?S=AWD&Y=2021,English,A,"This course reflects the role of workers who develop and facilitate programs for young people through a range of community-based programs designed to address the social, behavioural, health, welfare, developmental and protection needs of young people.","Youth work may be undertaken through employment in community, government and youth sector agencies.",Australia,Yes,Yes,,Yes,Yes,"
Completion of the Core Skills Profile for Adults (CSPA) and
",Normal,No
CERTI,TAFE SA,Adelaide City,Certificate I in English Proficiency,Education and Languages,"$6,449",,AUD,Year,6,Months,,,,,,,https://www.tafesa.edu.au/xml/course/aw/aw_AC00110.aspx?S=AWD&Y=2021,English,A,"If you are a beginner level (International Second Language Proficiency Rating (ISLPR) entry level 0+ in speaking, listening, reading and writing) migrant for whom English is an additional language, this course will help you to communicate orally and in writing at a basic level of English.",Certificates in English Proficiency have been designed to provide participants with an opportunity to enter the appropriate level of language development for their particular needs and skill level.,Australia,Yes,Yes,,Yes,Yes,"To be eligible for this fee free course you must be an Australian citizen, permanent resident, bridging visa or skilled migrant visa holder. You must provide evidence of visa letter at time of enrolment",Normal,No
CERTII,TAFE SA,Adelaide City,Certificate II in English Proficiency,Education and Languages,"$7,370",,AUD,Year,6,Months,,,,,,,https://www.tafesa.edu.au/xml/course/aw/aw_AC00109.aspx?S=AWD&Y=2021,English,A,"This course is designed for pre-intermediate level students for whom English is an additional language. It aims to develop social, educational and vocational goals and develop competencies in speaking, listening, reading and writing to function effectively within the Australian community. It can prepare students to look for work in the future and develop skills for further study.",Certificates in English Proficiency have been designed to provide participants with an opportunity to enter the appropriate level of language development for their particular needs and skill level.,Australia,Yes,Yes,,Yes,Yes,"To be eligible for this fee free course you must be an Australian citizen, permanent resident, bridging visa or skilled migrant visa holder. You must provide evidence of visa letter at time of enrolment",Normal,No
CERTIII,TAFE SA,Adelaide City,Certificate III in English Proficiency,Education and Languages,"$9,213 -
                          $10,050",,AUD,Year,6,Months,,,,,,,https://www.tafesa.edu.au/xml/course/aw/aw_AC00112.aspx?S=AWD&Y=2021,English,A,"This course is designed to assist intermediate level migrants (International Second Language Proficiency Rating (ISLPR) entry level 1+ to 2 in speaking, listening, reading and writing) for whom English is an additional language. It can help participants to communicate orally and in writing at an intermediate level of English.",Certificates in English Proficiency have been designed to provide participants with an opportunity to enter the appropriate level of language development for their particular needs and skill level.,Australia,Yes,Yes,,Yes,Yes,"To be eligible for this fee free course you must be an Australian citizen, permanent resident, bridging visa or skilled migrant visa holder. You must provide evidence of visa letter at time of enrolment",Normal,No
CERTI,TAFE SA,Adelaide City,Certificate IV in English Proficiency,Education and Languages,"$6,868",,AUD,Year,6,Months,,,,,,,https://www.tafesa.edu.au/xml/course/aw/aw_AC00113.aspx?S=AWD&Y=2021,English,A,"This flexible program is suitable for upper intermediate level students for whom English is an additional language, or international students (IELTS 5.5 / ISLPR 2+ and above in speaking, listening, reading and writing).",Certificates in English Proficiency have been designed to provide participants with an opportunity to enter the appropriate level of language development for their particular needs and skill level.,Australia,Yes,Yes,,Yes,Yes,"To be eligible for this fee free course you must be an Australian citizen, permanent resident, bridging visa or skilled migrant visa holder. You must provide evidence of visa letter at time of enrolment",Normal,No
DIP,TAFE SA,Adelaide City,Diploma of English Proficiency,Education and Languages,"$9,037",,AUD,Year,6,Months,,,,,,,https://www.tafesa.edu.au/xml/course/aw/aw_AC00072.aspx?S=AWD&Y=2021,English,A,"This flexible program is suitable for advanced level non-English speaking students, migrants or international, (IELTS 6.0 / ISLPR 3 and above in speaking, listening, reading and writing).","The Diploma of English Proficiency is designed for overseas-born and educated adults for whom English is an additional language and who wish to access business or professional employment or further training. The Diploma offers a balanced program of training in the four macro-skills of speaking, listening, reading and writing; and in language extension and cultural information related to specific professions.",Australia,Yes,Yes,,Yes,Yes,"To be eligible for subsidised training you must be an Australian citizen, permanent resident, bridging visa or skilled migrant visa holder. You must provide evidence of visa letter at time of enrolment",Normal,No
,TAFE SA,,Advanced English Speaking and Listening,Education and Languages,,,AUD,Year,,Months,,,,,,,https://www.tafesa.edu.au/xml/course/sc/sc_T816552497.aspx,English,A,,,Australia,Yes,Yes,,Yes,Yes,,Normal,No
,TAFE SA,,Advanced English Writing and Grammar,Education and Languages,,,AUD,Year,,Months,,,,,,,https://www.tafesa.edu.au/xml/course/sc/sc_T697032175.aspx,English,A,,,Australia,Yes,Yes,,Yes,Yes,,Normal,No
,TAFE SA,,General English 40,Education and Languages,,,AUD,Year,,Months,,,,,,,https://www.tafesa.edu.au/xml/course/aw/aw_BR00001.aspx?S=INT&Y=2021,English,A,"Our General English courses are designed for international students and other temporary visa holders looking to improve their English for personal or professional development. You don’t need to be planning to study in a TAFE SA award course to study at the English Language Centre. The course will be tailored to your individual needs, depending on your level of English, goals and study pathways. The course focuses on; developing listening, speaking, reading and writing skills, improving vocabulary, improving grammar and developing communication skills. New courses begin weekly, with a short pre-course assessment and interview to ensure you are enrolled
at a level that suits you.",,Australia,Yes,Yes,,Yes,Yes,,Normal,No
,TAFE SA,,English for Academic Purposes 20,Education and Languages,,,AUD,Year,,Months,,,,,,,https://www.tafesa.edu.au/xml/course/aw/aw_BR00003.aspx?S=INT&Y=2021,English,A,"This course is designed for students with good English language skills who are planning to do further study at TAFE SA or university. With expert tuition by our experienced teachers, you will gain the academic English skills needed to reach your goals in the Australian academic environment.",,Australia,Yes,Yes,,Yes,Yes,,Normal,No
,TAFE SA,,English for Academic Purposes Advanced,Education and Languages,,,AUD,Year,,Months,,,,,,,https://www.tafesa.edu.au/xml/course/aw/aw_BR00006.aspx?S=INT&Y=2021,English,A,This course is aimed at students needing advanced English language skills for university study at undergraduate or postgraduate level. You will attend observation classes and join university campus tours to ensure you are fully prepared for your university career.,,Australia,Yes,Yes,,Yes,Yes,,Normal,No
,TAFE SA,,Preparing for Australian Defence Force - English,Education and Languages,,,AUD,Year,,Months,,,,,,,https://www.tafesa.edu.au/xml/course/sc/sc_T618440734.aspx,English,A,,,Australia,Yes,Yes,,Yes,Yes,,Normal,No
,TAFE SA,,Preparing for Australian Defence Force - Maths,Education and Languages,,,AUD,Year,,Months,,,,,,,https://www.tafesa.edu.au/xml/course/sc/sc_T618564241.aspx,English,A,,,Australia,Yes,Yes,,Yes,Yes,,Normal,No
,TAFE SA,,Preparing for Australian Defence Force - Science,Education and Languages,,,AUD,Year,,Months,,,,,,,https://www.tafesa.edu.au/xml/course/sc/sc_T360135880.aspx,English,A,,,Australia,Yes,Yes,,Yes,Yes,,Normal,No
