Level code,University,City,Courses,Faculty,Int fees,Local fees,Currency,Currency Time,Duration,Duration Time,Prerequiste_1,Prerequiste_2,Prerequiste_3,Prerequiste_1_grade,Prerequiste_2_grade,Prerequiste_3_grade,Website,course_lang,Availability,Description,Career outcomes,Country,Online,Offline,Distance,Face to face,Blended,Remarks,Course delivery mode,Free TAFE
CERTI,Batchelor Institute ,"Batchelor Campus, Regional Centres",Certificate I in Business,Business and Governance,,,AUD,Year,6,Months ,,,,,,,https://www.batchelor.edu.au/biite/wp-content/uploads/Business_BSB10115_2020_v1.0.pdf,English,A,This entry-level qualification allows individuals across a variety of industry sectors to develop basic skills and knowledge to prepare for work. They may undertake a range of simple tasks under close supervision. The range of technical skills and knowledge is limited.,No Specific Job Role but is the starting point to careers in office administration environments. ,Australia,Yes,Yes,,Yes,Yes,,Normal,No
CERTII,Batchelor Institute ,"Batchelor Campus, Regional Centres","Certificate II in Business 
","Business and Governance
",,,AUD,Year,1,Year,,,,,,,"https://www.batchelor.edu.au/biite/wp-content/uploads/Business_BSB20115_2020_v1.0.pdf
",English,A,"This qualification reflects the role of individuals in a variety of junior administrative positions who perform a range of mainly routine tasks using limited practical skills and fundamental operational knowledge in a defined context. Individuals in these roles generally work under direct supervision.
","The following job roles are defined for this course: / International Education Office Receptionist, / Legal Receptionist, / Administration Officer (Local Government), / Office Assistant, / Receptionist, / Administrative Assistant, / Information Desk Clerk, / Clerical Officer, / Data Entry Operator 
",Australia,Yes,Yes,,Yes,Yes,,Normal,No
CERTIII,Batchelor Institute ,"Batchelor Campus, Regional Centres","Certificate III in Business 
","Business and Governance
",,,AUD,Year,1,Year,,,,,,,https://www.batchelor.edu.au/biite/wp-content/uploads/Business_BSB30115_2020_v1.0.pdf,English,A,"This qualification reflects the varied roles of individuals across different industry sectors who apply a broad range of competencies using some discretion, judgment and relevant theoretical knowledge. They may provide technical advice and support to a team.",The following job roles are defined for this course: / Word Processing Operator / Information Officer / Data Entry Operator / Customer Service Officer / Payroll Officer / Clerical Officer,Australia,Yes,Yes,,Yes,Yes,,Normal,No
CERTIV,Batchelor Institute ,"Batchelor Campus, Regional Centres",Certificate IV in Business ,"Business and Governance
",,,AUD,Year,1,Year,,,,,,,https://www.batchelor.edu.au/biite/wp-content/uploads/Business_BSB41915_2020_v1.0.pdf,English,A,"This qualification is suitable for individuals working as board members, contact officers and senior staff within Aboriginal and Torres Strait Islander organisations. It also applies to public servants working with Aboriginal and Torres Strait Islander boards of governance.","The following job roles are defined for this course: / Executive Director, / Indigenous Organisation Board Member, / Non-Executive Director, / Board Member, / Board Secretary",Australia,Yes,Yes,,Yes,Yes,,Normal,No
CERTIII,Batchelor Institute ,"Batchelor Campus, Regional Centres",Certificate III in Community Services,"Community Service
",,,AUD,Year,1,year ,,,,,,,https://www.batchelor.edu.au/biite/wp-content/uploads/CS_CCHC32015_C3_v1.41.pdf,English,A,This qualification reflects the role of entry level community services workers who support individuals through the provision of person-centred services. Work may include day-to-day support of individuals in community settings or support the implementation of specific communitybased programs,"Residential Support Worker / Aboriginal Intake and Referral Worker / Community care worker / Client Contact,Aboriginal Community Development Worker / Welfare Support Worker / Support Worker (Community Services)",Australia,Yes,Yes,,Yes,Yes,,Normal,No
CERTI,Batchelor Institute ,Darwin,Certificate I in Construction,Construction,,,AUD,Year,6,Months ,,,,,,,https://www.batchelor.edu.au/biite/wp-content/uploads/CON_CPC10111_C1.pdf,English,A,"This qualification provides an introduction to the construction industry, its culture, occupations, job roles and workplace expectations. The units of competency cover essential work health and safety requirements, the industrial and work organisation structure, communication skills, work planning, and basic use of tools and materials. The qualification is built around a basic construction project unit that integrates the skills and embeds the facets of employability skills in context. ",Construction assistant,Australia,Yes,Yes,,Yes,Yes,,Normal,No
CERTII,Batchelor Institute ,Darwin,Certificate II in Construction,Construction,,,AUD,Year,12,Weeks,,,,,,,https://www.batchelor.edu.au/biite/wp-content/uploads/CON_CPC20112_2020_v1.01.pdf,English,A,This qualification provides an occupational outcome and a range of support tasks applicable to a majority of construction work sites. The qualification has core units of competency that are required in many Certificate III qualifications. The elective options are structured to allow choice from a range of units aligned at Certificate III level and in total could provide meaningful credit in a construction industry Australian Apprenticeship.,Builder’s labourer,Australia,Yes,Yes,,Yes,Yes,,Normal,No
,Batchelor Institute ,Darwin,"Prepare to work safely in the construction industry
",Construction,,,AUD,Year,1,Day ,,,,,,,https://www.batchelor.edu.au/biite/wp-content/uploads/CON__CPCCWHS1001_v1.2.pdf,English,A,"This unit of competency specifies the mandatory work health and safety training required prior to undertaking construction work. The unit requires the person to demonstrate personal awareness and knowledge of health and safety legislative requirements in order to work safely and prevent injury or harm to self and others. It covers identifying and orally reporting common construction hazards, understanding basic risk control measures, and identifying procedures for responding to potential incidents and emergencies. It also covers correctly selecting and fitting common personal protective equipment (PPE) used for construction work.",This unit is a pre-requisite to entry to all construction worksites,Australia,Yes,Yes,,Yes,Yes,,Normal,No
CERTI,Batchelor Institute ,"Desert People’s Centre Campus
",Certificate I in Conservation and Land Management,"Conservation, Land Management & Horticulture
",,,AUD,Year,6,Months ,,,,,,,https://www.batchelor.edu.au/biite/wp-content/uploads/CLM_AHC10116_C1_v1.31.pdf,English,A,This qualification is an entry-level qualification aimed at individuals entering the conservation and land management industry. It allows individuals to develop basic skills and knowledge to prepare for work. They may undertake a range of simple tasks under close supervision. The range of technical skills and knowledge is limited. ,"There are no specific job outcomes to this qualification, but the skills achieved will assist in successfully undertaking a Certificate II pre-vocational program for job outcome, or will facilitate entry into and Australian Apprenticeship.",Australia,Yes,Yes,,Yes,Yes,,Normal,No
CERTII,Batchelor Institute ,"Batchelor Campus, Desert People’s Centre Campus",Certificate II in Conservation and Land Management,"Conservation, Land Management & Horticulture
",,,AUD,Year,1,Year,,,,,,,https://www.batchelor.edu.au/biite/wp-content/uploads/CLM_AHC21016_C2_v1.2.pdf,English,A,"This qualification provides an occupational outcome in conservation and land management. Work would be carried out under general guidance and supervision. The qualification enables individuals to select an Indigenous land management, conservation earthworks, lands, parks and wildlife or natural area management context as a job focus or a mix of these.
",The following job roles are defined for this course: / Conservation Earthworks Trainee Pest Management Assistant (Feral Animals) / Landcare Assistant / Parks and Wildlife Officer / Indigenous Land Management Assistant ,Australia,Yes,Yes,,Yes,Yes,,Normal,No
CERTIII,Batchelor Institute ,"Desert People’s Centre Campus
",Certificate III in Conservation and Land Management,"Conservation, Land Management & Horticulture
",,,AUD,Year,1.5,Years,,,,,,,https://www.batchelor.edu.au/biite/wp-content/uploads/CLM_AHC31416_C3_v1.1.pdf,English,A,"This qualification provides a general vocational outcome in the conservation and land management industry. The qualification enables individuals to select an Indigenous land management, lands, parks and wildlife or natural area management context as a job focus or a mix of these.",Job roles and titles can vary at different workplaces. They could include: / Leadership roles as an Indigenous ranger / National parks worker / Revegetation worker or a land rehabilitation worker,Australia,Yes,Yes,,Yes,Yes,,Normal,No
CERTIII,Batchelor Institute ,"Batchelor Campus, Desert People’s Centre Campus, Borroloola Study Centre, Wadeye
",Certificate III in Early Childhood Education and Care,Early Childhood Education and Care,,,AUD,Year,1-2,Years,,,,,,,https://www.batchelor.edu.au/biite/wp-content/uploads/ECE_CHC30113_C3_v1.3.pdf,English,A,"This qualification reflects the role of workers in a range of Early Childhood Education settings who work within the requirements of the Education and Care Services National Regulations and the National Quality Standard. They support the implementation of an approved learning framework, and support children’s wellbeing, learning and development. Depending on the setting, educators may work under direct supervision or autonomously.",/ Child Care Worker,Australia,Yes,Yes,,Yes,Yes,,Normal,No
DIP,Batchelor Institute ,"Batchelor Campus, Desert People’s Centre Campus, Borroloola Study Centre, Wadeye
",Diploma of Early Childhood Education and Care,Early Childhood Education and Care,,,AUD,Year,1,Year,,,,,,,https://www.batchelor.edu.au/biite/wp-content/uploads/ECE_CHC50113_DIP_v1.31.pdf,English,A,This qualification reflects the role of early childhood educators who are responsible for designing and implementing curriculum in Early Childhood Education and care services. In doing so they work to implement an approved learning framework within the requirements of the Education and Care Services National Regulations and the National Quality Standard.,"Child Care Worker / Child Care Worker / Children’s Service Area Manager, Director, or Centre Manager / Group, team coordinator, leader (children’s services) / Program Leader (children’s services)",Australia,Yes,Yes,,Yes,Yes,,Normal,No
CERTIII,Batchelor Institute ,"Batchelor Campus, Desert People’s Centre Campus",Certificate III in Education Support,Education,,,AUD,Year,18,Months ,,,,,,,https://www.batchelor.edu.au/biite/wp-content/uploads/Education_CHC30213_C3_v1.5.pdf,English,A,"This qualification reflects the role of workers in a range of education settings, including public and independent schools and community education settings, who provide assistance and support to teachers and students under broad-based supervision",Aboriginal and/or Torres Strait Islander education worker / Indigenous language and culture teaching assistant / Education assistant / Language worker / Education assistant (special needs) / Literacy worker / Education support worker / Support worker (working with children with disabilities) / Home tutor / Teacher aide / Homeland teaching assistant / Teacher assistant,Australia,Yes,Yes,,Yes,Yes,,Normal,No
CERTIV,Batchelor Institute ,"Batchelor Campus, Desert People’s Centre Campus","Certificate IV in Education Support
",Education,,,AUD,Year,18,Months ,,,,,,,https://www.batchelor.edu.au/biite/wp-content/uploads/Education_CHC40213_C4_v1.4.pdf,English,A,"This qualification reflects the role of workers in a range of education settings, including public and independent schools and community education settings, who provide assistance and support to teachers and students under broad-based supervision",Occupational titles may include: / Aboriginal and/or Torres Strait Islander education worker / Indigenous language and culture teaching assistant / Education assistant / Language worker / Education assistant (special needs) / Literacy worker / Education support worker / Support worker (working with children with disabilities) / Home tutor / Teacher aide / Homeland teaching,Australia,Yes,Yes,,Yes,Yes,,Normal,No
DIP,Batchelor Institute ,"Batchelor Campus, Desert People’s Centre Campus","Diploma of Education 
",Education,,,AUD,Year,2.5,Years,,,,,,,https://www.batchelor.edu.au/biite/wp-content/uploads/Education_10183NAT_DIP_v1.3.pdf,English,A,The Qualification provides the opportunity for education workers to broaden their skills and knowledge base in the field of education support work. The qualification covers workers in a range of education and school settings who provide assistance and support in the classroom to facilitate student learning in collaboration with teachers and working with students under broad based supervision.,The qualification occupational titles may include: / Teacher Assistant / Education Worker / Tutor / Homeland teaching assistant / Education assistant (special needs) / Teacher aid / Aboriginal and Torres Strait Islander education officer.,Australia,Yes,Yes,,Yes,Yes,,Normal,No
CERTII,Batchelor Institute ,"Batchelor Campus, Desert People’s Centre Campus, Central Australian communities
","Certificate II in Family Wellbeing
","Family Wellbeing
",,,AUD,Year,6,Months,,,,,,,https://www.batchelor.edu.au/biite/wp-content/uploads/FW_10272NAT_C2_v1.2.pdf,English,A,"The Certificate II in Family Wellbeing is a program that addresses the physical, mental, emotional and spiritual issues that impact on an individual’s wellbeing, family unity and community harmony. The aim of the Certificate II in Family Wellbeing is to address unresolved personal and community issues, which can impact on individuals and families throughout their lives. These can manifest in grief and trauma, suicide and other forms of selfharm, identity issues, use of alcohol and other drug problems, family violence and over representation of Aboriginal and Torres Strait Islander peoples in the justice system.","It provides learners with the skills and knowledge to: / Take ownership of and address their personal issues / Seek relevant support and assistance / Develop the self-confidence to enter vocational training, employment or further education.",Australia,Yes,Yes,,Yes,Yes,,Normal,No
CERTII,Batchelor Institute ,Batchelor Campus,Certificate II in Aboriginal and/ or Torres Strait Islander Primary Health Care,Health ,,,AUD,Year,1,Year,,,,,,,https://www.batchelor.edu.au/biite/wp-content/uploads/Health_HLT20113_C2_v1.3.pdf,English,A,"This qualification reflects the role of workers who undertake a range of tasks under direct supervision to support the provision of primary health care services to Aboriginal and/or Torres Strait Islander clients and communities. Such work will be performed as part of a health clinic, centre or service. This qualification is suited to Australian Apprenticeship pathways and is appropriate for delivery within VET in Schools programs. No licensing, legislative or certification requirements apply to this qualification at the time of publication. ",Aboriginal and Torres Strait Islander health worker,Australia,Yes,Yes,,Yes,Yes,,Normal,No
CERTIV,Batchelor Institute ,Batchelor Campus,Certificate IV in Aboriginal and/ or Torres Strait Islander Primary Health Care ,Health ,,,AUD,Year,2,Years,,,,,,,https://www.batchelor.edu.au/biite/wp-content/uploads/Health_HLT40113_C4_v1.3.pdf,English,A,"This qualification reflects the role of Aboriginal and/or Torres Strait Islander people working to provide a range of support roles to Aboriginal and/or Torres Strait Islander clients and communities, including specific health promotion programs, advice and assistance with selfmanagement of chronic illness These workers can be expected to flexibly assume a variety of job roles and undertake a broad range of tasks either individually or as a member of a multidisciplinary team. ","Job roles of Aboriginal and/or Torres Strait Islander Health Workers vary greatly from the Aboriginal and/or Torres Strait Islander Health Workers may perform their work roles in a range of settings: / Health clinics, services and hospitals. / Aboriginal Community Controlled Health Organisations (ACCHOs). / Rural and remote locations, either through these services, or as visiting services",Australia,Yes,Yes,,Yes,Yes,,Normal,No
CERTIV,Batchelor Institute ,Batchelor Campus,Certificate IV in Aboriginal and/ or Torres Strait Islander Primary Health Care Practice,Health ,,,AUD,Year,2,Years,,,,,,,https://www.batchelor.edu.au/biite/wp-content/uploads/Health_HLT40213_C4_v1.4.pdf,English,A,"This qualification reflects the role of Aboriginal and/or Torres Strait Islander people working to provide a range of clinical primary health care services to Aboriginal and/or Torres Strait Islander clients and communities, including specific health care programs, advice and assistance with, and administration of, medication. These practitioners can be expected to flexibly assume a variety of job roles and undertake a broad range of tasks either individually or as a member of a multidisciplinary team. This qualification addresses the specific legislative responsibilities of Aboriginal and/ or Torres Strait Islander Health Practitioners and is required for national registration with the Aboriginal and Torres Strait Islander Health Practice Board of Australia within Australian Health Practitioner Regulatory Agency (AHPRA).","Aboriginal and/or Torres Strait Islander Health Practitioners may perform their work roles in a range of settings: / Health clinics, services and hospitals. / Aboriginal Community Controlled Health Organisations (ACCHOs). / Rural and remote locations, either through these services, or as visiting services. ",Australia,Yes,Yes,,Yes,Yes,,Normal,No
DIP,Batchelor Institute ,Batchelor Campus,Diploma of Aboriginal and/or Torres Strait Islander Primary Health Care Practice,Health ,,,AUD,Year,2,Years,,,,,,,https://www.batchelor.edu.au/biite/wp-content/uploads/Health_HLT50213_DIP_v1.3.pdf,English,A,"This qualification is specific to Aboriginal and/or Torres Strait Islander people working to provide a range of primary health care services to Aboriginal and/or Torres Strait Islander clients. The Diploma of Aboriginal and/or Torres Strait Islander Primary Health Care Practice defines the knowledge and skills for workers involved in Aboriginal and/ or Torres Strait Islander Primary Health Care and who work autonomously under the broad guidance of others. The Diploma qualification covers workers who have a basis of skills and knowledge in primary health care practice, which they may apply in clinical, management or education functions.","Aboriginal and/or Torres Strait Islander Health Workers may perform their work roles in a range of settings: / Health clinics, services and hospitals. / Aboriginal Community Controlled Health Organisations (ACCHOs). / Rural and remote locations, either through these services, or as visiting services.",Australia,Yes,Yes,,Yes,Yes,,Normal,No
,Batchelor Institute ,Batchelor Campus,Provide Cardiopulmonary Resuscitation (CPR),Health ,,,AUD,Year,4,Hours,,,,,,,https://www.batchelor.edu.au/biite/wp-content/uploads/Health_HLTAID001_v1.0.pdf,English,A,"This unit describes the skills and knowledge required to perform cardiopulmonary resuscitation (CPR) in line with the Australian Resuscitation Council (ARC) guidelines. This unit applies to all workers who may be required to provide CPR in a range of situations, including community and workplace settings. To maintain currency, this unit needs to be revised and reassessed annually. ",All jobs where staff are required to have CPR skills to perform their job role.,Australia,Yes,Yes,,Yes,Yes,,Normal,No
,Batchelor Institute ,Batchelor Campus,Provide an emergency First Aid response in an education and care setting ,Health ,,,AUD,Year,3,Days,,,,,,,https://www.batchelor.edu.au/biite/wp-content/uploads/Health_HLTAID004_v1.01.pdf,English,A,"This unit describes the skills and knowledge required to provide a First Aid response to infants, children and adults. The unit applies to educators and support staff working within an education and care setting who are required to respond to a first aid emergency, including asthmatic and anaphylactic emergencies. This unit of competency may contribute towards approved First Aid, asthma and anaphylaxis training under the Education and Care Services National Law and the Education and Care Services National Regulations (2011). To maintain currency, this unit needs to be revised and reassessed every three years. The CPR section requires annual renewal. ",There are no job roles defined for this course,Australia,Yes,Yes,,Yes,Yes,,Normal,No
,Batchelor Institute ,Batchelor Campus,Course in Immunisation Training for Aboriginal Health Workers and Aboriginal Health Practitioners,Health ,,,AUD,Year,1,Week,,,,,,,https://www.batchelor.edu.au/biite/wp-content/uploads/Health_10681NAT_v1.21.pdf,English,A,"The unit develops skills and knowledge required of an immunisation health worker to prepare for an immunisation clinic, manage the vaccine cold chain, consult with clients and provide immunisation information and administer and promote immunisation in Aboriginal communities in accordance with relevant state/territory and national legislation and guidelines. The unit applies to the Aboriginal Health Worker and Aboriginal Health Practitioner working independently or in a team conducting the immunisation service",/ Immunisation Health Worker,Australia,Yes,Yes,,Yes,Yes,,Normal,No
,Batchelor Institute ,Batchelor Campus,First Aid ,Health ,,,AUD,Year,3,Days,,,,,,,https://www.batchelor.edu.au/biite/wp-content/uploads/Health_UOE108_First-Aid_v1.11.pdf,English,A,"This course describes the skills and knowledge required to perform Cardiopulmonary Resuscitation (CPR) in line with Australian Resuscitation (ARC) guidelines; recognise and respond to life threatening emergencies and provide a First Aid response to a casualty. The course applies to all workers who may be required to provide an emergency first aid response in a range of situations, including community and workplace settings. To maintain currency, this course need to be revised and reassessed every three years. The CPR unit requires annual renewal. Students must demonstrate at least two continuous minutes of CPR on an adult manikin on the floor and an infant on a hard surface. Students will be issued a Statement of Attainment on the successful completion of all three units.",There are no job roles defined for this course.,Australia,Yes,Yes,,Yes,Yes,,Normal,No
,Batchelor Institute ,Batchelor Campus,First Aid for Early Childhood and Education,Health ,,,AUD,Year,3,Days,,,,,,,https://www.batchelor.edu.au/biite/wp-content/uploads/Health_UOE208_v1.011.pdf,English,A,"This unit describes the skills and knowledge required to provide a first aid response to infants, children and adults. The unit applies to educators and support staff working within an education and care setting who are required to respond to a first aid emergency, including asthmatic and anaphylactic emergencies. This unit of competency may contribute towards approved first aid, asthma and anaphylaxis training under the Education and Care Services National Law and the Education and Care Services National Regulations (2011). To maintain currency, this unit needs to be revised and reassessed every three years. The CPR section requires annual renewal.",There are no job roles defined for this course.,Australia,Yes,Yes,,Yes,Yes,,Normal,No
CERTI,Batchelor Institute ,"Batchelor Campus, Desert People’s Centre Campus, Regional centres and within organisations",Certificate I in Access to Vocational Pathways ,"Literacy, Numeracy and Foundation Skills",,,AUD,Year,6,Months,,,,,,,https://www.batchelor.edu.au/biite/wp-content/uploads/LN_FSK10113_C1_v1.1.pdf,English,A,This qualification is designed for individuals who require significant foundation skills support to access a vocational learning pathway.,No job roles are defined for this course. ,Australia,Yes,Yes,,Yes,Yes,,Normal,No
CERTI,Batchelor Institute ,"Batchelor Campus, Desert People’s Centre Campus, Regional centres and within organisations",Certificate I in Skills for Vocational Pathways ,"Literacy, Numeracy and Foundation Skills",,,AUD,Year,6,Months,,,,,,,https://www.batchelor.edu.au/biite/wp-content/uploads/LN_FSK10213_C1_v1.1.pdf,English,A,"This qualification is designed for individuals who need skills to prepare for a vocational pathway qualification or further foundation skills development. It is suitable for individuals who require: / A prevocational pathway to employment and vocational training / Reading, writing, numeracy, oral communication and learning skills at Australian Core Skills Framework (ACSF) Level 2 / Entry level digital technology and employability skills / Education, training and employment goals.",No job roles are defined for this course. ,Australia,Yes,Yes,,Yes,Yes,,Normal,No
