BA,University of Tasmania,Launceston,Bachelor of Maritime Engineering (Specialisation) (Honours) (24V1),College of Sciences and Engineering,"157,007",,AUD,Year,4,Years,ATAR,,,70,,,https://www.utas.edu.au/courses/24V1,English,A,"The Bachelor of Maritime Engineering (Specialisation) (Honours), is a distinctive Maritime Engineering degree and the only of its kind in the Southern hemisphere.",Working with so many skilled people who pull together to build these complex ships is probably the most satisfying part of the job.,Australia,Yes,Yes,,Yes,Yes,,Introduction to Maritime Engineering Design JEE252,Materials Technology JEE125,Materials & Production Processes for Maritime Infrastructure JEE253,Thermal Engineering JEE223,Finite Element Analysis JEE350,Calculus of Several Variables JEE235,Analysis of Machines and Structures JEE332,Engineering Circuits KAA112,Engineering Statics KAA110,Mathematics I JEE103,"This unit introduces the student to the overall philosophy, rational thought process and engineering techniques required for the conceptual design of marine structures, ocean vehicles and maritime engineering systems. The unit will also introduce student to the concepts of engineering ethics, human factors and sustainability in the context of maritime engineering design.  The student will be expected to apply problem solving, design and decision-making methodologies to meet client requirements and to comply with regulatory and industry specific constraints by formulating innovative solutions with intellectual independence.  The knowledge gained in this unit will be fundamental for future degree specific design units as well as for the final year capstone design project.","Engineers come across many different materials in their daily activities. This unit is designed to provide the students with the level of knowledge required for understanding engineering materials. JEE125 Materials Technology provides understanding of the chemistry, metallurgy and properties of engineering materials, and the connection between structure, processing and properties of a range of materials including metal alloys, ceramics and polymers, through theory and lab work. Emphasis is placed on actual case histories of material performance in practice, and the analysis of the causes of failure. The basic knowledge gained in this unit can be used as a foundation to be built upon in later stages of the Engineering Degree program.","This unit provides an introduction to fundamental aspects of the rational engineering approaches and issues which influence the construction of marine vessels, on-board systems and offshore structures including materials. The unit will serve sympathetic approaches of the procedures, processes, tools, techniques, strategies and tactics used for managing on-site construction and production operations in a multi-tasking team environment. This unit further develops soft skills gained in the first year and project management in the second year. Moreover, the unit will cover corrosion, heat treatments in steel, quality and safety related issues to understand its relevance for theory and practise employed during construction and production of maritime infrastructures.","Energy is one of the 21st century's biggest engineering issues, and thermodynamics (the science of energy) will play a key role in understanding the energy needs. JEE223 Thermal Engineering is a foundation unit designed to introduce the laws and concepts of engineering thermodynamics using several contemporary applications.","Finite
Element Analysis is an advanced unit that introduces the student to the theory
and application of the Finite Element Method in engineering analysis and
design. In addition to learning the theoretical bases of the finite element
method, the student will also develop his/her applied/practical engineering
skills by taking part in a problem-based learning activity conducted throughout
the semester.","This unit builds on foundations laid in first year core units Mathematics I and II giving extensive treatment of some of the more advanced areas of mathematics that have applications in engineering, particularly as tools for computer-based modelling, analysis and design related to heat and fluid flow. The unit aims to present students with methods for translating real engineering problems into mathematical form and guide them in developing mathematical techniques for the solution of such problems.","Analysis of Machines and Structures (JEE332) is an intermediate unit that introduces students to the linearized, elastic analysis techniques required for the design of Machines and Structures used in maritime engineering projects. Building upon the knowledge gained in Dynamics and combining it with the concepts gained in Introduction to Maritime Science, Engineering and Technology and Mechanics of Solids, the students are introduced to new theories and techniques required to make engineering decisions and calculations in the design of statically indeterminate structures and mechanical components with a special focus on dynamic response analysis. The knowledge gained in this unit will become the foundation for latter specialized structural analysis and design units of the Naval Architecture, Marine and Offshore Engineering and Ocean Engineering specialisations.","The unit presents a fundamental introduction to electrical circuits and is the first unit to cover this material for all engineers. It covers basic concepts used in the study of electricity and circuits, including the fundamental laws of electrical phenomena, and methods for the analysis of circuits based on the underlying physics and mathematical models. The circuit theorems are studied and applied to solve circuits containing resistors, capacitors and inductors. The unit covers transient and DC/AC circuits, including AC power analysis, three-phase circuits, frequency response and phasors. This unit is considered to be essential for all engineering students and forms the basis for many second, third and fourth year units. The unit assesses students through formal examination and the completion of a report on the practical work performed during the semester. After completing the unit, the student will be able to analyse a circuit containing single phase or three phase AC sources, as well as where transient and DC sources are present. The unit provides the student with the opportunity to become familiar with the safe operation and efficient use of electrical/electronic testing equipment.","The main objective of this unit is to develop the student's ability to analyse objects at rest or moving at constant velocity, in a simple and logical manner by applying rigid body mechanics. Students will gain an appreciation of the multiple applications of statics to different areas of engineering and the knowledge gained in this unit will lay the foundation for the study of more advanced units such as dynamics, fluid mechanics and solid mechanics.","This first year mathematics unit provides a broad introduction to the fundamental mathematical operations and methods (differentiation, integration and partial differentiation) and mathematical objects (vectors) needed in engineering and science. We initiate themes of mathematical modelling which are most important in connection with practical problems. This unit lays a solid foundation for more advanced mathematics undertaken in semester two and higher years.","2020: $1,190.00",,"2020: $1,190.00","2020: $1,190.00","2020: $1,190.00","2020: $1,190.00","2020: $1,190.00","Compute and design optimal loads for power delivered, and power factor correction systems in AC circuits containing capacitors, inductors, resistors as well as mutual induction devices and transformers., Analyse and compute the currents and potential differences in DC circuits., Analyse the currents and potential differences in dynamic circuits based on linear ordinary differential equations of first and second order., Compute power delivered to a load by an induction machine using complex current calculations.","Calculate reactions acting on particles and rigid bodies using free body diagrams and equilibrium equations., Analyse members that are subjected to systems of forces and moments to enable the construction of axial force, shear force and bending moment diagrams., Determine forces acting on individual members of frames, machines and trusses., Determine the centroids, 2nd moments and product of area and inertial properties of various areas and simple objects.","2020: $1,190.00"
BA,University of Tasmania,Launceston,Bachelor of Applied Science (Nautical Science) (23Q),College of Sciences and Engineering,,,AUD,Year,4.5,Years,ATAR,,,,,,https://www.utas.edu.au/courses/23q,English,A,"Our degree is built to prepare you for your career at sea, with unmatched training and experience, you will have the flexibility to choose your own path as a Navigating Deck Officer. In addition to developing broad and coherent nautical knowledge required to work in any position as a Navigation Officer aboard a vessel, you will acquire core skills in operational aspects, control precision, and spatial orientation.","""I just love how different every day is – on any day, I could be climbing a Navigation Mast, entering an enclosed space, or navigating some of the busiest oceans in the world. These are only a tiny number of my work-stories, and if you look at the other benefits of a seagoing career (equal time leave & plenty of money!) you are able to pursue the most incredible leave adventures"".",Australia,Yes,Yes,,Yes,Yes,,,,,,,,,,,,,,,,,,,,,,,,,,,,,,,
BA,University of Tasmania,Launceston,Bachelor of Applied Science (Marine Engineering) (23R),College of Sciences and Engineering,,,AUD,Year,4,Years,ATAR,,,,,,https://www.utas.edu.au/courses/23r,English,A,"Our degree is built to prepare you for your career at sea, with unmatched training and experience, you will have the flexibility to choose your own path as a Marine Engineer. In addition to developing broad and coherent knowledge of marine engineering required to undertake maintenance work in any position aboard a vessel, you will acquire core skills in operation monitoring, system analysis, and complex problem solving.","“AMC has a good reputation, which is one of the main reasons I chose to study here. My qualification has given me a kick start in the industry as an Engineer Watchkeeper. After completing my initial course and working at sea for 9 years, I decided to return to AMC to further my career prospects and obtain my Class 2 Engineer qualification”",Australia,Yes,Yes,,Yes,Yes,,,,,,,,,,,,,,,,,,,,,,,,,,,,,,,
BA,University of Tasmania,Launceston,Bachelor of Maritime Engineering (Specialisation) (Honours) - AUT (24V2),College of Sciences and Engineering,"157,007",,AUD,Year,4,Years,,,,,,,https://www.utas.edu.au/courses/24V2,English,A,,"The Bachelor of Engineering (Naval Architecture) with Honours prepares students for careers in the shipbuilding industry, designing and constructing luxury super yachts, sailing and power craft, destroyers and patrol boats for the defence industry, underwater vehicles and submarines, and big ocean cruiseliners; the high-speed ferry industry; insurance sector; and marine consultancy firms. It is also an excellent gateway to a career in government in the areas of commercial shipping, transport policy and administration.",Australia,Yes,Yes,,Yes,Yes,,Analysis of Machines and Structures JEE332,Research Project (Part:2/2) JEE419,Design Project (Part:1/2) JEE421,Research Project (Part:1/2) JEE418,Design Project (Part:2/2) JEE422,Applied Computational Fluid Dynamics JEE480,Finite Element Analysis JEE350,Bluefin: Maritime Engineering JEE358,,,"Analysis of Machines and Structures (JEE332) is an intermediate unit that introduces students to the linearized, elastic analysis techniques required for the design of Machines and Structures used in maritime engineering projects. Building upon the knowledge gained in Dynamics and combining it with the concepts gained in Introduction to Maritime Science, Engineering and Technology and Mechanics of Solids, the students are introduced to new theories and techniques required to make engineering decisions and calculations in the design of statically indeterminate structures and mechanical components with a special focus on dynamic response analysis. The knowledge gained in this unit will become the foundation for latter specialized structural analysis and design units of the Naval Architecture, Marine and Offshore Engineering and Ocean Engineering specialisations.","This unit is an individual research project conducted over two semesters in the final year of the course. The student conducts a research project in a relevant topic of their choice, and produces a high quality written report on this work, which is then presented to their peers and independent external assessors.",This is the capstone design unit for all three Maritime Engineering degrees (Naval Architecture; Ocean Engineering; Marine and Offshore Engineering). This unit consolidates the knowledge and capabilities developed throughout the previous years of study. Maritime Engineering design involves complex solutions developed through the combined inputs of various discipline specialists. This unit further develops your project management skills including the ability to work with team members from other fields of study.,"This unit is an individual research project conducted over two semesters in the final year of the course. The student conducts a research project in a relevant topic of their choice, and produces a high quality written report on this work, which is then presented to their peers and independent external assessors.",This is the capstone design unit for all three Maritime Engineering degrees (Naval Architecture; Ocean Engineering; Marine and Offshore Engineering). This unit consolidates the knowledge and capabilities developed throughout the previous years of study. Maritime Engineering design involves complex solutions developed through the combined inputs of various discipline specialists. This unit further develops your project management skills including the ability to work with team members from other fields of study.,"The design and analysis of engineering fluid systems and marine vehicles require the prediction of the fluid behaviour and the interaction between the fluid and the system. This requires a good knowledge of thermo-fluid dynamic principles and the behaviour under varying boundary and operational conditions. This unit introduces students to numerical methods used to solve applied maritime hydrodynamics, fluid dynamics and thermo-fluid dynamics problems. It includes the use of commercial CFD packages and the analysis of results and flow visualisation to investigate the flow and behaviour of the fluid system or marine vehicle. It builds on the knowledge gained in Fluid Dynamics and relevant mathematical concepts.","Finite
Element Analysis is an advanced unit that introduces the student to the theory
and application of the Finite Element Method in engineering analysis and
design. In addition to learning the theoretical bases of the finite element
method, the student will also develop his/her applied/practical engineering
skills by taking part in a problem-based learning activity conducted throughout
the semester.","The unit facilitates the translation of theory learned across a range of prior and concurrent subjects within the Bachelor Degree course into practical application via hands-on projects conducted at sea aboard the AMC 35-metre vessel Bluefin.  Additionally, students will be engaged in marine operations which expose relevant issues unique to the deep-sea environment and are then tasked with addressing those issues to ensure the safe completion of the operation.  An emphasis on human safety, professional and environmental ethics and integrity and the development of a sense of practicality underpins the context in which all such activities and projects are undertaken.  Project research and planning activities will precede the 5-day voyage with the subsequent completion of a concise report within a short timeframe afterwards.",,,"2020: $1,190.00","2020: $1,190.00","2020: $1,190.00","2020: $1,190.00","2020: $1,190.00","2020: $1,190.00","2020: $1,190.00","2020: $1,190.00",,
BA,University of Tasmania,Launceston,Bachelor of Maritime Engineering (Specialisation) (Honours) - ECU (24V3),College of Sciences and Engineering,"157,007",,AUD,Year,4,Years,,,,,,,https://www.utas.edu.au/courses/24V3,English,A,,"The Bachelor of Engineering (Naval Architecture) with Honours prepares students for careers in the shipbuilding industry, designing and constructing luxury super yachts, sailing and power craft, destroyers and patrol boats for the defence industry, underwater vehicles and submarines, and big ocean cruiseliners; the high-speed ferry industry; insurance sector; and marine consultancy firms. It is also an excellent gateway to a career in government in the areas of commercial shipping, transport policy and administration.",Australia,Yes,Yes,,Yes,Yes,,Analysis of Machines and Structures JEE332,Research Project (Part:2/2) JEE419,Design Project (Part:1/2) JEE421,Research Project (Part:1/2) JEE418,Design Project (Part:2/2) JEE422,Applied Computational Fluid Dynamics JEE480,Finite Element Analysis JEE350,Bluefin: Maritime Engineering JEE358,,,"Analysis of Machines and Structures (JEE332) is an intermediate unit that introduces students to the linearized, elastic analysis techniques required for the design of Machines and Structures used in maritime engineering projects. Building upon the knowledge gained in Dynamics and combining it with the concepts gained in Introduction to Maritime Science, Engineering and Technology and Mechanics of Solids, the students are introduced to new theories and techniques required to make engineering decisions and calculations in the design of statically indeterminate structures and mechanical components with a special focus on dynamic response analysis. The knowledge gained in this unit will become the foundation for latter specialized structural analysis and design units of the Naval Architecture, Marine and Offshore Engineering and Ocean Engineering specialisations.","This unit is an individual research project conducted over two semesters in the final year of the course. The student conducts a research project in a relevant topic of their choice, and produces a high quality written report on this work, which is then presented to their peers and independent external assessors.",This is the capstone design unit for all three Maritime Engineering degrees (Naval Architecture; Ocean Engineering; Marine and Offshore Engineering). This unit consolidates the knowledge and capabilities developed throughout the previous years of study. Maritime Engineering design involves complex solutions developed through the combined inputs of various discipline specialists. This unit further develops your project management skills including the ability to work with team members from other fields of study.,"This unit is an individual research project conducted over two semesters in the final year of the course. The student conducts a research project in a relevant topic of their choice, and produces a high quality written report on this work, which is then presented to their peers and independent external assessors.",This is the capstone design unit for all three Maritime Engineering degrees (Naval Architecture; Ocean Engineering; Marine and Offshore Engineering). This unit consolidates the knowledge and capabilities developed throughout the previous years of study. Maritime Engineering design involves complex solutions developed through the combined inputs of various discipline specialists. This unit further develops your project management skills including the ability to work with team members from other fields of study.,"The design and analysis of engineering fluid systems and marine vehicles require the prediction of the fluid behaviour and the interaction between the fluid and the system. This requires a good knowledge of thermo-fluid dynamic principles and the behaviour under varying boundary and operational conditions. This unit introduces students to numerical methods used to solve applied maritime hydrodynamics, fluid dynamics and thermo-fluid dynamics problems. It includes the use of commercial CFD packages and the analysis of results and flow visualisation to investigate the flow and behaviour of the fluid system or marine vehicle. It builds on the knowledge gained in Fluid Dynamics and relevant mathematical concepts.","Finite
Element Analysis is an advanced unit that introduces the student to the theory
and application of the Finite Element Method in engineering analysis and
design. In addition to learning the theoretical bases of the finite element
method, the student will also develop his/her applied/practical engineering
skills by taking part in a problem-based learning activity conducted throughout
the semester.","The unit facilitates the translation of theory learned across a range of prior and concurrent subjects within the Bachelor Degree course into practical application via hands-on projects conducted at sea aboard the AMC 35-metre vessel Bluefin.  Additionally, students will be engaged in marine operations which expose relevant issues unique to the deep-sea environment and are then tasked with addressing those issues to ensure the safe completion of the operation.  An emphasis on human safety, professional and environmental ethics and integrity and the development of a sense of practicality underpins the context in which all such activities and projects are undertaken.  Project research and planning activities will precede the 5-day voyage with the subsequent completion of a concise report within a short timeframe afterwards.",,,"2020: $1,190.00","2020: $1,190.00","2020: $1,190.00","2020: $1,190.00","2020: $1,190.00","2020: $1,190.00","2020: $1,190.00","2020: $1,190.00",,
