Level code,University,City,Courses,Faculty,Int fees,Local fees,Currency,Currency Time,Duration,Duration Time,Prerequiste_1,Prerequiste_2,Prerequiste_3,Prerequiste_1_grade,Prerequiste_2_grade,Prerequiste_3_grade,Website,course_lang,Availability,Description,Career outcomes,Country,Online,Offline,Distance,Face to face,Blended,Remarks,Subject or unit name 1,Subject or unit name 2,Subject or unit name 3,Subject or unit name 4,Subject or unit name 5,Subject or unit name 6,Subject or unit name 7,Subject or unit name 8,Subject or unit name 9,Subject or unit name 10,subject or unit description 1,subject or unit description 2,subject or unit description 3,subject or unit description 4,subject or unit description 5,subject or unit description 6,subject or unit description 7,subject or unit description 8,subject or unit description 9,subject or unit description 10,Subect or unit objective 1,Subect or unit objective 2,Subect or unit objective 3,Subect or unit objective 4,Subect or unit objective 5,Subect or unit objective 6,Subect or unit objective 7,Subect or unit objective 8,Subect or unit objective 9,Subect or unit objective 10
BA,University of Tasmania,Hobart,Bachelor of Agricultural Science with Honours (S4A),College of Sciences and Engineering,"151,527",,AUD,Year,4,Years,ATAR,,,60,,,https://www.utas.edu.au/courses/s4a,English,A,"The Bachelor of Agricultural Science provides a sound basis in the physical and biological sciences before you specialise in a broad range of agricultural science disciplines, giving you comprehensive multi-disciplinary knowledge suitable for careers all over the world.","There is a growing demand for skilled Agricultural Science graduates. The knowledge you will gain can see you working all over the globe, in both government and private sectors, indoors, outdoors, in the lab and the field.",Australia,Yes,Yes,,Yes,Yes,,Agronomy KLA331,"Cell Biology, Genetics and Evolution KPZ164",Biology of Plants KPA161,Pasture and Animal Science KLA211,Animal Science KLA326,Microbiology KLA210,Ecology KPZ163,Chemistry 1A Hobart KRA113,Crop Protection and Biosecurity KLA311,GIS: Introduction KGG102,"Examines the status of agronomy, including developments in breeding, physiology and management. Farming systems research is also examined through a study of topics such as seasonal forecasting and climate change,  crop sequence, crop simulation modelling and precision farming.","Cell biology, genetics and evolution are fundamental to an understanding of the processes of life. In this unit, we examine the structure and function of prokaryotic and eukaryotic cells, including a discussion of the energy flow in photosynthesis, respiration and metabolism. We introduce DNA structure and function from molecular to organism levels, and current applications of DNA technology. We also introduce classical genetic and evolutionary theory as unifying explanations of life. Laboratory practicals investigate enzyme function, cytogenetics, and the genetic analysis of populations.","Biology of Plants is a 1st year core unit for students specialising in plant science, biotechnology, and marine science. In Biology of Plants we introduce you to the origin, diversity, structure and internal processes of plants. In lectures and practical classes, we examine the fine structure of plant cells, the organisation of tissues, structure, development and sexual reproduction in flowering plants. We also examine how plants function (photosynthesis, water relations, nutrition and responses to environmental signals). In practical classes and lectures, we survey the diversity of protists (algae) and land plants (mosses, ferns, conifers and flowering plants), their origins, life-histories and evolutionary trends that have led to the successful colonisation of land.","Introduces students to the production and management of pastures and general ruminant nutrition. In the pastures component topics include pasture types and species, pasture establishment, plant growth and development, grass-legume relationships, essential nutrients for pastures, seasonality of production and fodder conservation. The animal component examines the digestive physiology of ruminants compared with monogastrics, basic nutrition (protein, energy, water, vitamins, minerals, etc.), the development of feeding systems, feedstuff analysis, ration formulations, introductory animal breeding and genetics, animal selection methods, alpaca and goat production. Practicals provide experience in pasture assessment and laboratory techniques for the determination of feed quality.","This unit explores animal science within the scope of modern agriculture. During the unit, students will gain knowledge of the science underpinning different aspects of modern animal production. Students will be encouraged to engage with the scientific literature and identify suitable sources of information when completing the assessment tasks.","Provides students with a basic knowledge of microbiology including bacteria, fungi, protozoans and viruses. The unit considers the place of microorganisms in the evolution of life on earth, their structure, chemistry, biology and ecology, and consideration of their role in disease, ecosystems, food production and biotechnology. The practical component provides students with skills in the cultivation and identification of bacteria and fungi, as well as an introduction to techniques in molecular microbiology.","A series of lectures and associated practical classes introduces fundamental concepts in ecology of both plants and animals. It also introduces behavioural and evolutionary ecology and experimental methods. There is a strong emphasis placed on developing skills in practical ecology and scientific writing. Students are expected to participate in some group activities. This unit is taught in a blended style with most material delivered face to face, and some  delivered online.","Together with Chemistry 1B, this unit is a required prerequisite for those students intending to major in Chemistry and for those intending to proceed to 2nd year chemistry. It provides students with fundamental knowledge and concepts in inorganic, physical, analytical, and organic chemistry, with applications in both the physical and biological sciences. Topics include bonding and structure, thermodynamics and the chemistry of organic functional groups. Laboratory sessions are designed to increase students' manipulative skills and, where possible, to reinforce the lecture program.","Studies the principles and practices of management of plant diseases, pests and weeds. Modules of teaching within the unit will include: (1) Weeds (2) Pest and Disease Monitoring and Decision Making (3) Chemicals in Crop Protection (4) Cultural Control and Host Plant Resistance (5) Biological Control and (6) Integrated Pest and Disease Management.","Geographic Information Systems (GIS) are used in a wide range of disciplines to investigate and display characteristics of data that vary with location. Producing a map to present spatial information is a skill that is itself valuable to scientists in visualising such data, but the GIS has further capabilities in performing logical operations on multiple data sets obtained over a region. Through practical sessions within this unit you will acquire skills in using GIS. Supporting lectures address the principles behind spatial data representation, data structures, cartography, projections, data models, and spatial analysis. Emphasis is placed on the foundations of GIS for the input, management, and querying of spatial data, and these fundamentals are illustrated with a range of interesting environmental and social applications. Irrespective of your discipline, the skills and concepts acquired in this unit will benefit your appreciation of the spatial nature of information and interpretation of spatial data characteristics. This unit forms part of the GIS and Remote Sensing Major and Minor.",,,,,50101,,,,,
ADEG,University of Tasmania,Hobart,Associate Degree in Agribusiness (Z2A),,"50,875",,AUD,Year,2,Years,,,,,,,https://www.utas.edu.au/courses/z2a,English,A,"The Associate Degree in Agribusiness is an industry-focused course that prepares people to become dynamic, creative, and adaptable practitioners with the skills and knowledge to ensure that the business of agriculture is profitable and sustainable in a modern economic climate. It is an ideal steppingstone for those currently working in agriculture who wish to move into leadership and management roles, or a great foundation for those wishing to enter the industry.",Career Outcomes,Australia,Yes,Yes,,Yes,Yes,,Fundamental Principles of Agriculture (A) ZAB221,Business Finance ZAA133,Herd and Pasture Management ZAB229,Managing People ZAA132,Principles of Soil Management ZAB224,Data and Analysis ZAB114,"Principles of Weed, Pest and Disease Management ZAB119","E-agribusiness, Technology and Innovation ZAB226",Value Chain Management in Agribusiness ZAB116,Fundamental Principles of Agriculture (B) ZAB222,"This unit will provide you with an understanding of biological, geological, chemical and physical processes, in an agricultural context (commercial food and fibre productions systems). Processes explored will include biogeochemical cycles, photosynthesis, respiration, energy flows and transfer of nutrients. You will learn about the roles and interactions of living organisms and non-living components of agricultural production systems. You will have the opportunity to explore agricultural production systems and processes through practical experiences, tutorials and workshops.","This unit will provide you with an understanding of financial concepts, practices and tools used to measure and assess the financial performance of a business within the business operating environment. Throughout the unit, case studies, tasks and simulations will develop your skills and knowledge to apply financial practices and processes to create financial statements and reports for business.","This unit focuses on the critical components of animal management on profitability and sustainability of ruminant production systems. Topics will include animal health, welfare, fertility and genetics. You will investigate the main factors affecting ruminant health and the strategies available to prevent and manage such conditions. You will explore how animal ethics and welfare need to be incorporated into farm planning. The unit will provide examples of how farmers improve ruminant reproductive performance, irrespective of their farming system and how they make informed decisions around breeding.","The effective and efficient operation of business is human resource intensive. Strategies used to attract, motivate, manage and retain the right people are essential skills for all business managers for business success. This unit introduces you to how Human Resource practices including functions such as recruitment, training, performance management and teamwork. You will explore the legal framework incorporating fairness and respect, health and safety, and equity and diversity that underpins human resource practice, using business examples and applied activities.","In this unit you will discover how soil characteristics including plant nutrient availability, pH, electrical conductivity and physical and biological properties underpin and inform the development and implementation of soil management strategies. You will also investigate how soil health, plant productivity and ecosystem services can be influenced by production activities including land use, irrigation, cultivation and applications of soil amendments such as organics, fertiliser, lime and gypsum.","In this unit, you will be introduced to mathematical and statistical methods for analysing scientific, business or technical data to inform and support decision-making. You will explore why data is needed and how it is used to make decisions, including how data are collected, analysed, interpreted and presented, and you will learn and apply a suite of common statistical and mathematical methods to generate evidence for decision-making. You will also be introduced to data management software and learn how to represent and communicate mathematical and statistical information effectively. Through case studies relevant to your discipline, you will learn how to problem solve, generate evidence, and present solutions using data handling and statistical approaches.","In this unit you will explore the risks and challenges of pests, weeds and diseases in primary production, in terms of the relative impact on productivity, profitability and market access. You will also investigate various on-farm control methods that are used within an Integrated Pest Management framework to manage those risks. You will be provided with on-farm scenarios to investigate potential solutions for issues using a design thinking approach.","This unit creates a practical awareness of e-enabled agribusiness and the use of technology in areas such as precision agriculture, livestock tracking and food traceability.  You will explore the concepts of innovation including the innovation diffusion process and observe the difference between product and process innovation. The unit will prepare you to evaluate the opportunities technologies and e-business can provide new and existing agri-businesses.","In this unit you will be introduced to the concept of value chains and how they are managed in primary production to improve business performance. Value chain management (VCM) is an important strategy that integrates supply chain components and processes with performance management, monitoring, communication, governance and value. You will investigate stakeholders, beneficiaries, value chain structure and value-creating elements, and be exposed to how a focus on value can benefit all the businesses in a producer-to-consumer chain. Through online learning activities, case studies, tutorials and workshops, you will explore how enablers and barriers can affect net value of products to end users and each participant and impact the efficiency and effectiveness of the whole value chain.","In this unit you will explore the human impact of agricultural production on the services provided by the chemical, physical, biological and geological Earth systems. You will also be introduced to how these services can impact agricultural production in relation to biosecurity, food security, food quality and food safety. You will be provided the opportunity to find practice based integrated management solutions that are sustainable, economically viable, socially and ethically acceptable and environmentally feasible.","2020: $1,190.00","2020: $1,394.00",,"2020: $1,394.00","2020: $1,190.00","2020: $1,190.00",,"2020: $1,190.00","2020: $1,394.00","2020: $1,190.00"
DIP,University of Tasmania,Hobart,Diploma of University Studies (21A),,,,AUD,Year,1,Year,,,,,,,https://www.utas.edu.au/courses/21a,English,A,Students completing the Diploma of University Studies will meet the University’s General Entry Requirements and will have guaranteed entry into specified bachelor degrees (dependent on specialisation).,The Diploma of University Studies is a pathway program for bachelor level study.,Australia,Yes,Yes,,Yes,Yes,,Global Geographies of Change KGA171,Academic Writing XAB021,Academic Numeracy XAB091,Learning at University XAB011,"Space, Place and Nature KGA172",,,,,,"This introduction to geography and environmental studies integrates physical and social science inquiry. You study earth evolution, human development and their interaction, in light of questions about sustainability. You apply this knowledge to issues of vital importance around the world and in Tasmania, including climate change, population change, inequality, food security, natural hazards and globalisation. Interactive workshops enable you to explore these issues through training in mapping and fieldwork, and group projects, scenario building and class debates. Knowledge and skills developed in this unit can be applied in a wide variety of professions including environmental science and management, social policy and planning, spatial science, international development and nature conservation. Students wishing to enrol in second and third year units in geography and environmental studies should also take KGA172 Space, Place and Nature in Semester 2, which can be taken before KGA171 for mid-year entry students.","In this unit you will develop your ability to communicate in written form in a university environment. You will gain the skills and develop strategies to plan and write academically. In particular, you will analyse assignment tasks, learn how to structure an essay, draw on your critical thinking skills, and synthesise multiple academic sources and reference these in-text.","In this unit you will develop the mathematical knowledge, skills, and confidence essential for further University study. In particular, you will explore and apply methods for:","This unit provides underpinning skills, theories, techniques, and strategies to prepare you for University-level study and to understand yourself as a learner. You will be introduced to concepts of self-management and relevant practical skills that can be applied effectively in other units. You will explore concepts such as strengths-based learning, engagement and flow, motivation, work/life balance, resilience strategies, critical thinking, and work styles. In addition, you will learn and utilise practical skills such as reflective writing, preparing oral presentations, productivity, transferable skills, goal setting, research methods, career investigation, expository writing, mind mapping and effective study techniques. The overarching aim of this unit is to provide you with the recognition of your strengths and skills, strategies to develop confidence as a student and to be successful in your future university studies.","This foundation unit in Geography and Environmental Studies develops your knowledge of the ways in which people turn space into place, how patterns of landforms, soils, plants and animals form on the surface of the earth, and how cultures, societies and economies manage, and are affected by, ecosystem processes. Workshops, many of which are in the field, will provide you with tools to spatially relate geographic phenomena, describe landforms, soils and vegetation, and undertake value analyses of environmental and cultural issues. Local examples that have wider application will be the focus of workshops. This unit is useful for a wide variety of occupations and professions, as well as enhancing everyday existence. Students wishing to do second and third year units in Geography and Environmental Studies should also take KGA171 The Global Geography of Change.",,,,,,,2020: $835.00,"2020: $1,190.00",2020: $835.00,"demonstrate basic geographical knowledge of ecological and social systems, identify and analyse different value positions that shape human relationships with nature, apply geographical skills to collect ecological and social data, and use this to create basic maps and graphs, communicate critical thinking through literature‐based research, visual presentation of geographic data, teamwork and practices of academic integrity",,,,,
BA,University of Tasmania,Hobart,Bachelor of Agriculture with Honours (S4X),College of Sciences and Engineering,"35,950",,AUD,Year,1,Year,,,,,,,https://www.utas.edu.au/courses/s4x,English,A,,,Australia,Yes,Yes,,Yes,Yes,,Honours A KLA478,,,,,,,,,,"(a) they have achieved an
adequate standard, normally a credit average in Group 3 units, and (b) that a
suitable project and supervisor are available.",,,,,,,,,,,,,,,,,,,
