BA,University of Tasmania,Launceston,Bachelor of Global Logistics and Maritime Management (P3E),College of Sciences and Engineering,"99,244",,AUD,Year,3,Years,ATAR,,,65,,,https://www.utas.edu.au/courses/p3e,English,A,"The Bachelor of Global Logistics and Maritime Management provides graduates with high-level expertise and knowledge to understand the maritime business in the global arena, the world-wide spanning logistics services and strategies, as well as the structuring, operation and coordination of supply chains.","The maritime and the logistics industries underpin international business and world trade. They are a key element in sustainable development, and are tightly interconnected with human society: physically, socially and economically.",Australia,Yes,Yes,,Yes,Yes,,Transport Research Project JNB359,Warehousing and Distribution JNB258,Global Procurement JNB357,Logistics Management JNB225,International Transport Systems JNB158,Analytical Methods for Decision-Making JNB164,Ship Chartering JNB365,Human Factors and Risk Management in the Maritime Industry JND307,Air Freight Transport JNB161,Resilience in the Face of Emergencies JNB262,This unit is designed to provide students with an opportunity to complete their final year project by employing various research methods and techniques with which they have been equipped. The aim of this unit is to encourage students to apply the principles of business research in conducting a real-life research project in the maritime and logistics related fields.,"This unit introduces you to the fundamentals of warehousing management and related distribution issues that are important for pursuing a career in the logistics, transport and maritime industries. Academic understanding and applied skills will be developed to the point where you will be able to analyse existing warehouse layout, processes, safety systems and equipment in order to identify ways to improve operational efficiency.","In today's global business context the procurement of various commodities, their sourcing strategies and the total cost of acquisition impact on an organisation's capacity to be competitive. Global Procurement examines key issues relating to purchasing and procurement; additionally it investigates the procurement process in a range of applications including public, project, retail, commodity, services and facilities procurement.",This unit provides students with a broad appreciation of the nature and importance of logistics activities and an understanding of some of the key concepts and tools used by logistics managers. After studying the unit students should be able to contribute positively to the logistics management activities in a company.,"International Transport Systems provides students with an understanding of international transport and the way it operates. The unit will cover various topics such as transport modes (road, rail, air and water transport) and terminals, global transport system, inter-modal transport, transport and logistics, the relationship between transport and economic development, social and environmental impacts of transport, and transport policy and planning. This unit lays the foundation for students to progress into the study of other units at the Department of Maritime & Logistics Management, for example Logistics and Supply Chain Management.","This unit introduces students to both quantitative and qualitative methods and their applications to decision-making in business management. The unit covers data analysis techniques around data presentation and interpretation, estimation, sampling, hypothesis testing and regression analysis, but it also broadly discussed decision analysis and decision making under uncertainty.","This unit involves comprehending, analysing and evaluating the processes and practices which bring shipowners and cargo owners together in a contractual relationship for carrying cargo. This business is usually facilitated by intermediaries called brokers. The aim of this unit is to provide you with a comprehensive sketch of the concepts, principles and practice which underpin the commercial employment of ships under charter arrangements.","Human Factors is a multi-disciplinary applied science that integrates the fields of psychology, engineering, ergonomics, management and industrial design. Human Factors pivots around the processes of effective system design, and deals with areas such as personnel selection; personnel training; machine design; job design; and, environmental design. This unit provides an introduction to the range of issues covered in human factors and supports the development of some basic skills used by human factors professionals to study occupational environments.","This unit covers a wide range of topics relating to the air freight transport industry including its management and operation, economic and market characteristics, airports and aircraft, marketing and pricing strategies, forecasting, cargo handling and terminal management, designed to give you a holistic picture of the air freight transport industry. The discussion of air freight transport will focus on the movement of cargo by air in both domestic and global markets. The unit will also introduce you to policies and regulations that govern the air freight transport industry.","This unit is designed to respond to the growing challenge that natural and other disasters pose to organisations and individuals. It will provide individuals with insight into how to improve resilience at multiple different levels considering personal, community, organisational and at global levels.  The unit itself also embeds the requirement to build skills in auditing and project design, fundamental skills for professionals working in management, logistics and other aligned professions. Indeed, any person working in a professional organisation may be exposed to emergencies, disasters or crises and this unit provides an introduction to principles, knowledge and skills that will be useful in responding to and recovering from these sorts of events. The unit also addresses a ‘wicked problem’ – specifically – we seek greater levels of resilience at times when the challenges to that resilience has also never been greater. By needing to consider and respond to this issue students will be supported to navigate complicated problems with unclear, even impossible solutions.",,,,,,"Differentiate between the nature and aspects of quantitative and qualitative methods for decision analysis, Describe data using numerical measures and graphical methods, Explain the basics of data collection and sampling methods, Identify data analysis problems related to business management, Apply relevant analytical methods to solve management problems","Explain shipping market reports and discuss the structure and content of key documents, describe the role of brokers and agents operating in shipping markets and discuss their legal and ethical responsibilities, analyse charterparties and discuss the obligations, liabilities and entitlements of shipowners and charterers, estimate financial returns from prospective alternative voyages of a ship and determine the most suitable option.","Assess human factor issues in the maritime environment and develop an appropriate response., Analyse a maritime-related task using hierarchical task analysis (HTA) to identify errors in the procedure, Examine a maritime accident and illustrate the causes using a theoretical model of accident causation, Assess the implications of human factor issues for the wider maritime community to devise a solution.",,"Explain the psychological, physiological, sociological, behavioural and organisational principles that underpin human responses to emergencies., Identify factors that support individual resilience to emergencies and develop skills in applying these in preparedness for emergencies via auditing and project design., Develop skills in critical reflection including reflection of your own resilience to emergencies and how developing resilience could be extended to other aspects of life., Analyse how key concepts (e.g., safety, resilience) interact at individual, group and community levels to support social responsibility and sustainability."
BA,University of Tasmania,Hobart,Bachelor of Business with Honours (G4F),College of Business & Economics,"30,950",,AUD,Year,1,Year,,,,,,,https://www.utas.edu.au/courses/g4f,English,A,The aim of the honours year is to enable students to develop further their interests and research skills and to provide a foundation for postgraduate study in the Tasmanian School of Business and Economics (TSBE).,,Australia,Yes,Yes,,Yes,Yes,,Data Analysis and Management BMA418,Honours Research Seminar in Accounting and Business Management BMA402,Introduction to Honours Research in Accounting and Business Management BFA410,Dissertation A BFA442,Developing research topics in Accounting and Business Management BFA406,Dissertation B BFA443,,,,,"This unit explores, practically, the management and analysis of qualitative and quantitative data. Seminars and practical sessions explore the principles and practices of organising and analysing data using software support. The qualitative component explores computer-supported analysis using NVivo. Topics include data formatting, coding, developing and refining node (data category) systems, auditing analytical processes, developing research conclusions, and reporting research methods and results. The quantitative component explores computer supported analysis using SPSS.","Introduces students to the principles and practices used to effectively communicate about research. Learning and assessment activities develop an understanding of the principles of good research communication, and the capabilities required to effectively communicate about research to an interdisciplinary academic audience.","Introduces students to a range of research methods in the scholarly study of issues in accounting and related disciplines. the learning activities are designed to develop research skills so that students are well equipped to competently and confidently critique academic and professional research in general and counting and business-related research studies in particular. even more importantly they provide students with the skills to design and conduct their own research in a rigorous manner. the material covered includes approaches to theory building guidelines for developing a research proposal importance of an threats to internal and external validity, research designs for specific projects, research methods appropriate for alternative research design data collection and data analysis.","Candidates are required to present a dissertation of around 15,000 words on a topic approved by the Head of School.","BFA406 examines the principles and processes used to identify a research opportunity, and to articulate and justify the focus and purpose of a research study. The unit will examine topics such as 1) how research contributes to the development of theory, policy, and professional practice, 2) types of research and research contribution, 3) the role of theory in research, 4) Tracking development of a theory over time, and 5) alternative ways of framing a research focus. It will also examine strategies and practices for reviewing literature, including approaches for mapping a literature to figure out what work has been done and what gaps remain, and approaches for presenting a literature review to justify a particular research focus.","Candidates are required to present a dissertation of around 15,000 words on a topic approved by the Head of School.",,,,,,"Identify and explain what constitutes best practice in academic knowledge transfer., Critically evaluate research presentations using agreed criteria., Incorporate elements of best practice into your own research presentation., Communicate complex research ideas in both oral and written forms","develop knowledge of the key concepts, processes, and considerations in research design., critically review literature as a foundation for an honours research project., identify and justify appropriate research methods for a research project., identify and accommodate ethical considerations in research design, and practice.",,"Explain the significance of theory in academic research., Critically review the functions of an Honours dissertation in Accounting and Business Management., Demonstrate application of the academic skills of analysis and interpretation in evaluating the literature pertinent to your research topic., Justify research question(s) based on the literature reviewed., Communicate complex research ideas in both oral and written forms.",,,,,
BA,University of Tasmania,Hobart,Bachelor of Economics with Honours (C4E),College of Business & Economics,"30,950",,AUD,Year,1,Year,,,,,,,https://www.utas.edu.au/courses/c4e,English,A,The aim of the honours year is to enable you to further develop your research and communication skills and to provide a foundation for postgraduate study in either Economics or Finance.,"The Bachelor of Economics (Hons) degree opens up many career opportunities and past graduates have established careers in a wide range of activities. Some examples include: central banking, commercial consulting, commercial banking, local government, administration, management, market research, merchant banking, political advising, stockbroking and teaching.",Australia,Yes,Yes,,Yes,Yes,,,,,,,,,,,,,,,,,,,,,,,,,,,,,,,
BA,University of Tasmania,Launceston,Bachelor of Global Logistics and Maritime Management with Honours (P4H),College of Sciences and Engineering,"32,950",,AUD,Year,1,Year,,,,,,,https://www.utas.edu.au/courses/p4h,English,A,The Bachelor of Global Logistics and Maritime Management with Honours program provides outstanding undergraduate students with an extra year of advanced study and research that enhances their knowledge and analytical skills in the field of maritime and logistics management.,"The Honours program provides graduating candidates with a competitive advantage when seeking employment. Traditionally, Honours graduates are well regarded by employers because of their high level of academic achievement, well-developed research skills, and proven ability to work independently with minimal direct supervision.",Australia,Yes,Yes,,Yes,Yes,,,,,,,,,,,,,,,,,,,,,,,,,,,,,,,
ADEG,University of Tasmania,Launceston,Associate Degree in Global Logistics and Maritime Management (P2E),College of Sciences and Engineering,"50,875",,AUD,Year,2,Years,ATAR,,,57,,,https://www.utas.edu.au/courses/p2e,English,A,"This course provides students with knowledge of critical elements of the maritime and logistics industries, enabling business and management problem-solving skills to be applied to key industry issues. The course provides the necessary grounding in maritime and international logistics, covering essential topics relevant to international business management, transport systems and the maritime industry.","The course will allow graduates to contribute to operations and management in the international logistics and maritime industries. Organisations active in international trade, such as those involved in exporting and importing, global transport, ship management, international freight forwarding and ports and terminals will be potential employers. Additionally the course will provide a solid grounding in international logistics and maritime transport issues for people employed in government and other policy-related areas.",Australia,Yes,Yes,,Yes,Yes,,Maritime Economics JNB260,Port and Terminal Management JNB204,International Business Communication JNB154,Maritime Law JNB253,Introduction to the Maritime Industry JNB156,Exporting and Importing JNB160,Commercial and Transport Law JNB163,Ship Operations Management JNB261,,,"The objective of this unit is to provide a general understanding of the organisation and operation of the maritime industry from an economics perspective. The main focus is on the economic behaviour of shipowners, shippers, and other stakeholders in the markets for liquid bulk, dry bulk and container shipping, shipbuilding and second-hand ships.",This unit aims to provide you with a general understanding of the role and significance of ports and of key factors associated with the management and operations of ports. You will be introduced to the operating environment of ports and a range of port management functions and operational activities which are the foundation of the role of ports. The unit will also address emerging trends in the role of ports and contemporary management practices in ports. The unit is arranged to meet the need of students at different stages in their careers and at different levels in their organisations.,"International Business Communication enables students to develop the fundamental written and verbal communication skills necessary for effective communication in their international business careers and their academic studies. Additionally, the significance of communication skills to successful business organisations is explored.","Maritime Law is a key unit for those interested in the legal underpinnings of world trade, commerce and development.","This unit provides students with a good understanding of individual sectors in the maritime industry. It introduces the maritime industry’s history, maritime geography and the concept of maritime transport in facilitating international trade. This unit covers various maritime sectors such as shipping, shipbuilding, repairs and maintenance, ports, offshore energy, maritime tourism, maritime governance and defence and Law enforcement. Finally, key contemporary issues related to the maritime industry are addressed.",This unit is designed to provide students with the essential elements of modern exporting and importing practice. It attempts to blend the academic rigour of the principles of international trade with practical and operational aspects of export and import management.,Business and transport law is both broad and specific in its reach. This unit introduces broad foundations to business law within Australia before specifically applying understandings gained to the laws governing transport within Australia.,"This unit examines the technical and operational aspects of managing ships. The unit explores the ship-related operations that are necessary to transport cargo in a safe, efficient, and commercially viable manner. The unit analyses ships’ nautical, commercial, and cargo operations in detail. It studies the operational management of ships under the frameworks of commercial management, technical management and crew management.",,,"discuss the organisation and operation of the maritime industry from the economic perspective., explain the demand and supply of shipping services and their determinants., explain the operation and market structure of the bulk, general, and specialised shipping markets., analyse the key issues in maritime policies and regulations.","Explain the key issues in the commercial and operational aspects of port and terminal management, Evaluate the role, organisation and operation of ports and terminals in promoting the efficiency of the maritime and logistics sector, Apply relevant analytical frameworks to analyse the performance of ports and terminals under the effects of internal and external factors, and draw the implications for port management and stakeholders",,,"Describe the various commercial, industrial and governmental sectors comprising the Maritime Industry., Explain the relationships between the sectors of the Maritime Industry., Discuss the significance of the Maritime Industry to domestic and international trade and sustainable development.",,,"Explain the key ship operations necessary for providing maritime transport services, Analyse the impact of technological, regulatory, social and ethical factors on the management of ship operations, Evaluate management decisions for operating ships in a safe, sustainable and commercially viable manner",,
DIP,University of Tasmania,Launceston,Diploma of Global Logistics and Maritime Management (P1E),College of Sciences and Engineering,"31,950",,AUD,Year,1,Year,ATAR,,,50,,,https://www.utas.edu.au/courses/p1e,English,A,The Diploma of Global Logistics and Management aims to prepare students for their early careers in the maritime and logistics industries with the following skills.,"The Diploma of Global Logistics and Maritime Management is designed to prepare students for management and administrative careers in private enterprise, industry organisations and government in the areas of commercial shipping, ports and terminals, transport policy and administration, freight forwarding and exporting and importing.",Australia,Yes,Yes,,Yes,Yes,,International Business Communication JNB154,,,,,,,,,,"International Business Communication enables students to develop the fundamental written and verbal communication skills necessary for effective communication in their international business careers and their academic studies. Additionally, the significance of communication skills to successful business organisations is explored.",,,,,,,,,,,,,,,,,,,
DIP,University of Tasmania,Distance Sydney,Graduate Diploma of Health Service Management (C6I),College of Business & Economics,,,AUD,Year,1,Year,,,,,,,https://www.utas.edu.au/courses/c6i,English,A,,,Australia,Yes,Yes,,Yes,Yes,,,,,,,,,,,,,,,,,,,,,,,,,,,,,,,
DIP,University of Tasmania,Launceston,Graduate Diploma of Maritime and Logistics Management (J6N),College of Sciences and Engineering,"34,950",,AUD,Year,1,Year,,,,,,,https://www.utas.edu.au/courses/j6n,English,A,This course provides candidates with the extensive knowledge and analytical skills required to meet challenges facing the maritime and transport logistics industry and to enhance their career opportunities in management positions at both local and international levels. The Graduate Diploma aims to help candidates develop a holistic and analytical perspective of the industry.,"The organisations connected with the maritime and logistics industries are very diverse, including for instance large private companies, entrepreneurial start-ups and government entities. The diversity creates many opportunities for your career progression, both globally and domestically. For example, the maritime industry includes ports, shipping companies, stevedores and tourism and the logistics industry encompasses warehousing, road freight, air freight, freight forwarding and distribution. Additionally, many organisations may have a primary focus on manufacturing or international business, which will necessitate that they have internal departments involved in logistics, supply chain management and international trade, creating more opportunities. With logistics the fastest growing industry globally, there are many possibilities for you to choose.",Australia,Yes,Yes,,Yes,Yes,,Research Methods JNB508,,,,,,,,,,"This unit aims to provide a thorough understanding and appreciation of the nature and processes of research. It is specifically designed to help those students engaged in research for the first time. This unit will help develop skills as a researcher by addressing just what research is, and what is involved in the detail of the research process. Students will gain an understanding of issues which underlie the practice of research by studying conceptual frameworks of different researchers, by analysis of completed research studies, and by application of what they learn through their own research study.",,,,,,,,,,,,,,,,,,,
