Level code,University,City,Courses,Faculty,Int fees,Local fees,Currency,Currency Time,Duration,Duration Time,Prerequiste_1,Prerequiste_2,Prerequiste_3,Prerequiste_1_grade,Prerequiste_2_grade,Prerequiste_3_grade,Website,course_lang,Availability,Description,Career outcomes,Country,Online,Offline,Distance,Face to face,Blended,Remarks,Course delivery mode,Free TAFE
CERTII,South Metropolitan TAFE,Thornlie,MSF20313 Certificate II in Furniture Making (Cabinet Making/Furniture Making Pre-Apprenticeship),Building and Construction,,,AUD,Year,1,Semester,,,,,,,https://www.southmetrotafe.wa.edu.au/courses/certificate-ii-furniture-making-cabinet-makingfurniture-making-pre-apprenticeship,English,A,When you complete the Certificate II in Furniture Making (Cabinet Making/Furniture Making Pre-Apprenticeship) you'll be what employers are looking for as an apprentice furniture maker or cabinet maker.,Cabinetmaker,Australia,Yes,Yes,,Yes,Yes,OLNA or NAPLAN 9 Band 8 or C Grades in Year 10 English and Maths or equivalent or Certificate I or Certificate II,Normal,No
CERTIII,South Metropolitan TAFE,Rockingham,CPC32713 Certificate III in Gas Fitting,Building and Construction,,,AUD,Year,,,,,,,,,https://www.southmetrotafe.wa.edu.au/courses/certificate-iii-gas-fitting,English,A,This course is designed for people who are already working in an allied trade and have pre-existing skills. All students must already hold a Gas Fitting Permit to Work Under Supervision from Energy Safety WA (SMTAFE can arrange this) Students will need to record 250 hours of Gas Fitting with a Licensed Gas Fitter in WA as per Energy Safety requirements before they will be issued a permit to work unsupervised. These hours can be accumulated as soon as an individual has a Gas Fitting Permit to Work Under Supervision and are not required for the completion of the Certificate III.,,Australia,Yes,Yes,,Yes,Yes,OLNA or NAPLAN 9 Band 8 or C Grades in Year 10 English and Maths or equivalent or Certificate I or Certificate II,Normal,No
,South Metropolitan TAFE,Rockingham,Gas Safety,Building and Construction,,,AUD,Year,2,Days,,,,,,,https://www.southmetrotafe.wa.edu.au/courses/gas-safety,English,A,"The Gas Legislation and Safety course comprises three components, WA Gas Regulations, Gas Safety and Basic Combustion and Flueing.",,Australia,Yes,Yes,,Yes,Yes,,Normal,No
,South Metropolitan TAFE,Rockingham,Gas Standards Legislation,Building and Construction,,,AUD,Year,1,Day,,,,,,,https://www.southmetrotafe.wa.edu.au/courses/gas-standards-legislation,English,A,"The Gas Legislation and Safety course comprises three components, WA Gas Regulations, Gas Safety and Basic Combustion and Flueing.",,Australia,Yes,Yes,,Yes,Yes,,Normal,No
,South Metropolitan TAFE,Thornlie,General Legislative Requirements,Building and Construction,,,AUD,Year,,,,,,,,,https://www.southmetrotafe.wa.edu.au/courses/general-legislative-requirements,English,A,"To be eligible you must hold a current electrical workers licence, restricted licence is not acceptable.",,Australia,Yes,Yes,,Yes,Yes,,Normal,No
,South Metropolitan TAFE,,Grid Connect Design and Install Clean Energy Council Skill Set,Building and Construction,,,AUD,Year,,,,,,,,,https://www.southmetrotafe.wa.edu.au/courses/grid-connect-design-and-install-clean-energy-council-skill-set,English,A,The course runs for 5 consecutive days and contains theoretical and practical components and assessments. Over the five days students will cover the required Australian Standards and Clean Energy Council Guidelines for accredited Installers and Designers.,,Australia,Yes,Yes,,Yes,Yes,,Normal,No
,South Metropolitan TAFE,Thornlie,Infrastructure Ready Skill Set,Building and Construction,,,AUD,Year,,,,,,,,,https://www.southmetrotafe.wa.edu.au/courses/infrastructure-ready-skill-set,English,A,"Gain the skills to prepare for a career in infrastructure projects, and pick up your White Card along the way!",,Australia,Yes,Yes,,Yes,Yes,,Normal,No
,South Metropolitan TAFE,Thornlie,Infrastructure Ready Skill Set (Fee Free),Building and Construction,,,AUD,Year,,,,,,,,,https://www.southmetrotafe.wa.edu.au/courses/infrastructure-ready-skill-set-fee-free,English,A,"Gain the skills to prepare for a career in infrastructure projects, and pick up your White Card along the way!",,Australia,Yes,Yes,,Yes,Yes,,Normal,No
,South Metropolitan TAFE,,Introduction to Furniture Making Skill Set,Building and Construction,,,AUD,Year,,,,,,,,,https://www.southmetrotafe.wa.edu.au/courses/introduction-furniture-making-skill-set,English,A,"The introduction to Furniture Making Skill Set is suitable for participants wishing to gain basic furniture and cabinet making skills. Participants will be taught the set up and safe use of a wide variety of furniture/cabinet making hand tools and power tools to construct a Spice Rack Cabinet, complete with two doors and an adjustable shelf. Participants will also learn how to prepare all surfaces of this project in readiness for applying a finish.",,Australia,Yes,Yes,,Yes,Yes,,Normal,No
CERTIII,South Metropolitan TAFE,Rockingham,MEM30819 Certificate III in Locksmithing,Building and Construction,,,AUD,Year,6,Semesters,,,,,,,https://www.southmetrotafe.wa.edu.au/courses/certificate-iii-locksmithing,English,A,When you complete the Certificate III in Locksmithing you'll be looking at a career as a licensed locksmith.,,Australia,Yes,Yes,,Yes,Yes,OLNA or NAPLAN 9 Band 8 or C Grades in Year 10 English and Maths or equivalent or Certificate I or Certificate II,Apprenticeship,No
,South Metropolitan TAFE,Thornlie,Operation (Electrical) Legislative Requirements,Building and Construction,,,AUD,Year,,,,,,,,,https://www.southmetrotafe.wa.edu.au/courses/operation-electrical-legislative-requirements,English,A,"To be eligible you must hold a current electrical workers licence, restricted licence is not acceptable.",,Australia,Yes,Yes,,Yes,Yes,,Normal,No
,South Metropolitan TAFE,,PVC Pipe Handling and Installation,Building and Construction,,,AUD,Year,,,,,,,,,https://www.southmetrotafe.wa.edu.au/courses/pvc-pipe-handling-and-installation,English,A,"This course is a Water Corporation of WA accredited program, for operatives in the civil and construction areas working on land development projects where PVC pipe laying is required.",,Australia,Yes,Yes,,Yes,Yes,,Normal,No
,South Metropolitan TAFE,Thornlie,Painters Registration - Business and Estimating Skill Set,Building and Construction,,,AUD,Year,,,,,,,,,https://www.southmetrotafe.wa.edu.au/courses/painters-registration-business-and-estimating-skill-set,English,A,There are two units of the Course in Painters Registration included in this short course.,,Australia,Yes,Yes,,Yes,Yes,,Normal,No
,South Metropolitan TAFE,Thornlie,Painters Registration - Prepare Surface for Painting and Colour and Wallpapering Skill Set,Building and Construction,,,AUD,Year,,,,,,,,,https://www.southmetrotafe.wa.edu.au/courses/painters-registration-prepare-surface-painting-and-colour-and-wallpapering-skill-set,English,A,This short course covers two units from the Course in Painters Registration.,,Australia,Yes,Yes,,Yes,Yes,,Normal,No
CERTIII,South Metropolitan TAFE,Thornlie,CPC30611 Certificate III in Painting and Decorating,Building and Construction,,,AUD,Year,,,,,,,,,https://www.southmetrotafe.wa.edu.au/courses/certificate-iii-painting-and-decorating,English,A,When you complete the Certificate III in Painting and Decorating you will be ready for a certified trade career as a painter and decorator.,,Australia,Yes,Yes,,Yes,Yes,OLNA or NAPLAN 9 Band 8 or C Grades in Year 10 English and Maths or equivalent or Certificate I or Certificate II,Apprenticeship,No
CERTIII,South Metropolitan TAFE,Rockingham,CPC32413 Certificate III in Plumbing,Building and Construction,,,AUD,Year,,,,,,,,,https://www.southmetrotafe.wa.edu.au/courses/certificate-iii-plumbing,English,A,"When you complete the Certificate III in Plumbing you'll be looking at an in demand (and possibly lucrative) career as a plumber, or gasfitter.",,Australia,Yes,Yes,,Yes,Yes,OLNA or NAPLAN 9 Band 8 or C Grades in Year 10 English and Maths or equivalent or Certificate I or Certificate II,Apprenticeship,No
CERTII,South Metropolitan TAFE,Rockingham,52700WA Certificate II in Plumbing (Plumbing Pre-Apprenticeship),Building and Construction,,,AUD,Year,1,Semester,,,,,,,https://www.southmetrotafe.wa.edu.au/courses/certificate-ii-plumbing-plumbing-pre-apprenticeship,English,A,"When you complete the Certificate II in Plumbing (Plumbing Pre-Apprenticeship) you'll be what employers are looking for as an apprentice plumber, roof plumber, or gasfitter.",Plumber,Australia,Yes,Yes,,Yes,Yes,OLNA or NAPLAN 9 Band 8 or C Grades in Year 10 English and Maths or equivalent or Certificate I or Certificate II,Normal,No
,South Metropolitan TAFE,Rockingham,Plumbing Contracting Licensing (Business) Skill Set,Building and Construction,,,AUD,Year,,,,,,,,,https://www.southmetrotafe.wa.edu.au/courses/plumbing-contracting-licensing-business-skill-set,English,A,"The business units in this plumbing contracting skill set are considered self paced, as the first five days are mandatory campus attendance, then the study will be mainly online for the bulk of the course work, and then finalised by three days attendance at campus in this 12 week course.",,Australia,Yes,Yes,,Yes,Yes,,Normal,No
,South Metropolitan TAFE,Bentley,Plumbing Contracting Licensing (Specialist) Skill Set,Building and Construction,,,AUD,Year,,,,,,,,,https://www.southmetrotafe.wa.edu.au/courses/plumbing-contracting-licensing-specialist-skill-set,English,A,"The following theory components of the course require you to complete a workbook for each. You will be required to present these completed workbooks on the commencement of each theory class.
• Drainage
• Sanitary
• Backflow
• Water Supply",,Australia,Yes,Yes,,Yes,Yes,,Normal,No
CERTIII,South Metropolitan TAFE,Rockingham,CPC32612 Certificate III in Roof Plumbing,Building and Construction,,,AUD,Year,,,,,,,,,https://www.southmetrotafe.wa.edu.au/courses/certificate-iii-roof-plumbing,English,A,When you complete the Certificate III in Roof Plumbing you will be ready for a career as a roof plumber.,,Australia,Yes,Yes,,Yes,Yes,OLNA or NAPLAN 9 Band 8 or C Grades in Year 10 English and Maths or equivalent or Certificate I or Certificate II,Apprenticeship,No
,South Metropolitan TAFE,Rockingham,Service Type A Gas Appliances Skill Set,Building and Construction,,,AUD,Year,2,Weeks,,,,,,,https://www.southmetrotafe.wa.edu.au/courses/service-type-gas-appliances-skill-set,English,A,Applicants must hold a G Class gas permit from Energy Safety WA,,Australia,Yes,Yes,,Yes,Yes,,Normal,No
CERTIII,South Metropolitan TAFE,Rockingham,CPC31011 Certificate III in Solid Plastering,Building and Construction,,,AUD,Year,,,,,,,,,https://www.southmetrotafe.wa.edu.au/courses/certificate-iii-solid-plastering,English,A,When you complete the Certificate III in Solid Plastering you will be ready for a certified trade career as a solid plasterer.,,Australia,Yes,Yes,,Yes,Yes,OLNA or NAPLAN 9 Band 8 or C Grades in Year 10 English and Maths or equivalent or Certificate I or Certificate II,Apprenticeship,No
,South Metropolitan TAFE,,Testing and Tagging - Using a Portable Appliance Tester,Building and Construction,,,AUD,Year,,,,,,,,,https://www.southmetrotafe.wa.edu.au/courses/testing-and-tagging-using-portable-appliance-tester,English,A,This course will provide you with the skills and knowledge required to meet AS/NZS 3760 - the Australian standard on testing and tagging.,,Australia,Yes,Yes,,Yes,Yes,,Normal,No
CERTIII,South Metropolitan TAFE,Thornlie,RII31615 Certificate III in Trenchless Technology,Building and Construction,,,AUD,Year,,,,,,,,,https://www.southmetrotafe.wa.edu.au/courses/certificate-iii-trenchless-technology,English,A,"South Metropolitan TAFE provides quality training that serves both employers and employees. Employers gain the benefits of skilled and accredited employees and the employee gains the knowledge, skill, confidence and a sense of pride when completing the qualification. Training for any required gap units can be scheduled to align with workplace operations and may be conducted at the employer’s place of business if required.",,Australia,Yes,Yes,,Yes,Yes,OLNA or NAPLAN 9 Band 8 or C Grades in Year 10 English and Maths or equivalent or Certificate I or Certificate II,Traineeship,No
CERTIII,South Metropolitan TAFE,Rockingham,CPC31211 Certificate III in Wall and Ceiling Lining,Building and Construction,,,AUD,Year,,,,,,,,,https://www.southmetrotafe.wa.edu.au/courses/certificate-iii-wall-and-ceiling-lining,English,A,When you complete the Certificate III in Wall and Ceiling Lining you will be ready for a certified trade career as a wall and ceiling liner.,,Australia,Yes,Yes,,Yes,Yes,OLNA or NAPLAN 9 Band 8 or C Grades in Year 10 English and Maths or equivalent or Certificate I or Certificate II,Apprenticeship,No
CERTIII,South Metropolitan TAFE,Rockingham,CPC31311 Certificate III in Wall and Floor Tiling,Building and Construction,,,AUD,Year,,,,,,,,,https://www.southmetrotafe.wa.edu.au/courses/certificate-iii-wall-and-floor-tiling,English,A,When you complete the Certificate III in Wall and Floor Tiling you will be ready for a certified trade career as a wall and floor tiler.,,Australia,Yes,Yes,,Yes,Yes,OLNA or NAPLAN 9 Band 8 or C Grades in Year 10 English and Maths or equivalent or Certificate I or Certificate II,Apprenticeship,No
CERTI,South Metropolitan TAFE,Thornlie,BSB41419 Certificate IV in Work Health and Safety,Building and Construction,,,AUD,Year,,,,,,,,,https://www.southmetrotafe.wa.edu.au/courses/certificate-iv-work-health-and-safety,English,A,"When you complete the Certificate IV in Work Health and Safety you can expect to be a valued addition to any organisation as a work health and safety officer, or WHS coordinator.","Safety Inspector, Occupational & Environmental Health Professional",Australia,Yes,Yes,,Yes,Yes,"C Grades in Year 11 WACE General English, and OLNA; or NAPLAN 9 Band 8 or C Grades in Year 11 English and Maths or equivalent or Certificate II or Certificate III",Normal,No
DIP,South Metropolitan TAFE,Thornlie,BSB51319 Diploma of Work Health and Safety,Building and Construction,,,AUD,Year,,,,,,,,,https://www.southmetrotafe.wa.edu.au/courses/diploma-work-health-and-safety,English,A,"When you complete the Diploma of Work Health and Safety you can expect to be a valued addition to any organisation as a compliance officer, or WHS manager.","Compliance officer, Work, health and safety manager",Australia,Yes,Yes,,Yes,Yes,Completion of WACE General or ATAR (Minimum C Grades) or equivalent or Completion of WACE General or ATAR or equivalent (minimum C Grades) or Certificate III,Normal,No
,South Metropolitan TAFE,,Work Ready Painting and Decorating Skill Set,Building and Construction,,,AUD,Year,,,,,,,,,https://www.southmetrotafe.wa.edu.au/courses/work-ready-painting-and-decorating-skill-set,English,A,"This five-day short course will provide students with a taste of the Painting industry, as well as an opportunity to obtain a White Card.",,Australia,Yes,Yes,,Yes,Yes,,Normal,No
,South Metropolitan TAFE,Mandurah,Work Safety in Construction Skill Set,Building and Construction,,,AUD,Year,,,,,,,,,https://www.southmetrotafe.wa.edu.au/courses/work-safety-construction-skill-set,English,A,Learn the skills to prepare for a career in construction and pick up your White Card along the way.,Building and construction labourer,Australia,Yes,Yes,,Yes,Yes,,Normal,No
,South Metropolitan TAFE,Mandurah,Work Safety in Construction Skill Set (Fee Free),Building and Construction,,,AUD,Year,,,,,,,,,https://www.southmetrotafe.wa.edu.au/courses/work-safety-construction-skill-set-fee-free,English,A,Learn the skills to prepare for a career in construction and pick up your White Card along the way.,Building and construction labourer,Australia,Yes,Yes,,Yes,Yes,,Normal,No
DIP,South Metropolitan TAFE,Rockingham,FNS50217 Diploma of Accounting,Business and Finance,,,AUD,Year,1,Semester,,,,,,,https://www.southmetrotafe.wa.edu.au/courses/diploma-accounting,English,A,"Acquire the specific accounting techniques that will become the tools of your trade. The Diploma of Accounting will build on your knowledge gained at the Certificate IV level, and will prepare you for accounting positions within larger corporate organisations and growing companies. You will gain a more detailed understanding of day-to-day accounting work through practical training in operational activities.",,Australia,Yes,Yes,,Yes,Yes,,Normal,No
ADIP,South Metropolitan TAFE,Rockingham,FNS60217 Advanced Diploma of Accounting,Business and Finance,,,AUD,Year,1,Semester,,,,,,,https://www.southmetrotafe.wa.edu.au/courses/advanced-diploma-accounting,English,A,"If you enjoy accounting and mathematics, have an analytical mind and would like to work in the accounting profession, then our Advanced Diploma of Accounting is for you. Accountants support their clients with regular monitoring, analysis, preparation of documents, reports and accounts, and advice.",,Australia,Yes,Yes,,Yes,Yes,,Normal,No
CERTI,South Metropolitan TAFE,Rockingham,FNS40217 Certificate IV in Accounting and Bookkeeping,Business and Finance,,,AUD,Year,,,,,,,,,https://www.southmetrotafe.wa.edu.au/courses/certificate-iv-accounting-and-bookkeeping,English,A,This course has replaced the following courses:,,Australia,Yes,Yes,,Yes,Yes,"C Grades in Year 11 WACE General English, and OLNA; or NAPLAN 9 Band 8 or C Grades in Year 11 English and Maths or equivalent or Certificate II or Certificate III",Traineeship,No
CERTIII,South Metropolitan TAFE,Rockingham,FNS30317 Certificate III in Accounts Administration,Business and Finance,,,AUD,Year,,,,,,,,,https://www.southmetrotafe.wa.edu.au/courses/certificate-iii-accounts-administration,English,A,This course has replaced FNS30315 - State ID AWA4.,,Australia,Yes,Yes,,Yes,Yes,OLNA or NAPLAN 9 Band 8 or C Grades in Year 10 English and Maths or equivalent or Certificate I or Certificate II,Traineeship,No
CERTII,South Metropolitan TAFE,Mandurah,BSB20115 Certificate II in Business,Business and Finance,,,AUD,Year,1,Semester,,,,,,,https://www.southmetrotafe.wa.edu.au/courses/certificate-ii-business,English,A,When you complete the Certificate II in Business you'll have the skills to get your foot in the door in a clerical or administrative role in a broad range of workplaces.,,Australia,Yes,Yes,,Yes,Yes,OLNA or NAPLAN 9 Band 8 or C Grades in Year 10 English and Maths or equivalent or Certificate I or Certificate II,Normal,No
CERTIII,South Metropolitan TAFE,Rockingham,BSB30115 Certificate III in Business,Business and Finance,,,AUD,Year,,,,,,,,,https://www.southmetrotafe.wa.edu.au/courses/certificate-iii-business,English,A,"When you complete the Certificate III in Business you'll have skills that employers are looking for, making you ideal for roles in data entry, customer service, accounts or as an office clerk.",,Australia,Yes,Yes,,Yes,Yes,OLNA or NAPLAN 9 Band 8 or C Grades in Year 10 English and Maths or equivalent or Certificate I or Certificate II,Traineeship,No
CERTI,South Metropolitan TAFE,Rockingham,BSB40215 Certificate IV in Business,Business and Finance,,,AUD,Year,2,Semesters,,,,,,,https://www.southmetrotafe.wa.edu.au/courses/certificate-iv-business,English,A,"When you complete the Certificate IV in Business you will have a practical foundation to take you into a number of business and corporate careers: office management, start-up business planning and marketing, and customer service.",,Australia,Yes,Yes,,Yes,Yes,"C Grades in Year 11 WACE General English, and OLNA; or NAPLAN 9 Band 8 or C Grades in Year 11 English and Maths or equivalent or Certificate II or Certificate III",Traineeship,No
DIP,South Metropolitan TAFE,Bentley,BSB50215 Diploma of Business,Business and Finance,,,AUD,Year,1,Semester,,,,,,,https://www.southmetrotafe.wa.edu.au/courses/diploma-business,English,A,When you complete the Diploma of Business you will have what it takes for a career in both the government and private sectors.,,Australia,Yes,Yes,,Yes,Yes,Completion of WACE General or ATAR (Minimum C Grades) or equivalent or Completion of WACE General or ATAR or equivalent (minimum C Grades) or Certificate III,Normal,No
CERTIII,South Metropolitan TAFE,Armadale,BSB30415 Certificate III in Business Administration,Business and Finance,,,AUD,Year,1,Semester,,,,,,,https://www.southmetrotafe.wa.edu.au/courses/certificate-iii-business-administration,English,A,"When you complete the Certificate III in Business Administration you'll have skills that employers are looking for, making you ideal for roles in data entry, customer service, or as an office or accounts clerk, secretary or receptionist.",,Australia,Yes,Yes,,Yes,Yes,OLNA or NAPLAN 9 Band 8 or C Grades in Year 10 English and Maths or equivalent or Certificate I or Certificate II,Normal,No
CERTI,South Metropolitan TAFE,Rockingham,BSB40515 Certificate IV in Business Administration,Business and Finance,,,AUD,Year,,,,,,,,,https://www.southmetrotafe.wa.edu.au/courses/certificate-iv-business-administration,English,A,"When you complete the Certificate IV in Business Administration you will be set for a career with expanding possibilities: in office management, or business administration.",,Australia,Yes,Yes,,Yes,Yes,"C Grades in Year 11 WACE General English, and OLNA; or NAPLAN 9 Band 8 or C Grades in Year 11 English and Maths or equivalent or Certificate II or Certificate III",Traineeship,No
DIP,South Metropolitan TAFE,Thornlie,BSB50415 Diploma of Business Administration,Business and Finance,,,AUD,Year,,,,,,,,,https://www.southmetrotafe.wa.edu.au/courses/diploma-business-administration,English,A,"When you complete the Diploma of Business Administration you will have what it takes for a career as a project manager, sales manager or office/administration manager.",,Australia,Yes,Yes,,Yes,Yes,Completion of WACE General or ATAR (Minimum C Grades) or equivalent or Completion of WACE General or ATAR or equivalent (minimum C Grades) or Certificate III,Normal,No
CERTIII,South Metropolitan TAFE,Murdoch,BSB31115 Certificate III in Business Administration (Medical),Business and Finance,,,AUD,Year,1,Semester,,,,,,,https://www.southmetrotafe.wa.edu.au/courses/certificate-iii-business-administration-medical,English,A,When you complete the Certificate III in Business Administration (Medical) you'll have skills that may be suitable for a medical administration support role.,,Australia,Yes,Yes,,Yes,Yes,OLNA or NAPLAN 9 Band 8 or C Grades in Year 10 English and Maths or equivalent or Certificate I or Certificate II,Normal,No
,South Metropolitan TAFE,Armadale,Business Ready Skill Set,Business and Finance,,,AUD,Year,,,,,,,,,https://www.southmetrotafe.wa.edu.au/courses/business-ready-skill-set,English,A,"This skill set is the perfect introduction to office administration, clerical work and reception work","General Clerk, Receptionist, Administrator",Australia,Yes,Yes,,Yes,Yes,,Normal,No
,South Metropolitan TAFE,Armadale,Business Ready Skill Set (Fee Free),Business and Finance,,,AUD,Year,,,,,,,,,https://www.southmetrotafe.wa.edu.au/courses/business-ready-skill-set-fee-free,English,A,"This skill set is the perfect introduction to office administration, clerical work and reception work","General Clerk, Receptionist, Administrator",Australia,Yes,Yes,,Yes,Yes,,Normal,No
,South Metropolitan TAFE,Rockingham,BSBSS00095 Cross-Sector Infection Control Skill Set,Business and Finance,,,AUD,Year,,,,,,,,,https://www.southmetrotafe.wa.edu.au/courses/cross-sector-infection-control-skill-set,English,A,"In these unprecedented times, new regulations need infection control practices in all workplaces to protect workers from pandemic infection risk.",,Australia,Yes,Yes,,Yes,Yes,,Normal,No
,South Metropolitan TAFE,Fremantle,Customer Service Skill Set,"Hospitality, Tourism and Events",,,AUD,Year,,,,,,,,,https://www.southmetrotafe.wa.edu.au/courses/customer-service-skill-set,English,A,"Gain the skills to create good relationships with customers, provide quality service and help a business to improve customer service levels.","Receptionist, Customer service assistant",Australia,Yes,Yes,,Yes,Yes,,Normal,No
,South Metropolitan TAFE,Fremantle,Customer Service Skill Set (Fee Free),"Hospitality, Tourism and Events",,,AUD,Year,,,,,,,,,https://www.southmetrotafe.wa.edu.au/courses/customer-service-skill-set-fee-free,English,A,"Gain the skills to create good relationships with customers, provide quality service and help a business to improve customer service levels.","Receptionist, Customer service assistant",Australia,Yes,Yes,,Yes,Yes,,Normal,No
CERTI,South Metropolitan TAFE,Rockingham,BSB41015 Certificate IV in Human Resources,Business and Finance,,,AUD,Year,1,Year,,,,,,,https://www.southmetrotafe.wa.edu.au/courses/certificate-iv-human-resources,English,A,"When you complete the Certificate IV in Human Resources you are setting yourself up for a career in building productive businesses with the most capable staff; as a human resource officer, recruitment assistant or in human resources development.",,Australia,Yes,Yes,,Yes,Yes,"C Grades in Year 11 WACE General English, and OLNA; or NAPLAN 9 Band 8 or C Grades in Year 11 English and Maths or equivalent or Certificate II or Certificate III",Traineeship,No
DIP,South Metropolitan TAFE,Bentley,BSB50618 Diploma of Human Resources Management,Business and Finance,,,AUD,Year,1,Semester,,,,,,,https://www.southmetrotafe.wa.edu.au/courses/diploma-human-resources-management,English,A,When you complete the Diploma of Human Resources Management you will have what it takes for a career as a human resources manager or human resources officer.,,Australia,Yes,Yes,,Yes,Yes,Completion of WACE General or ATAR (Minimum C Grades) or equivalent or Completion of WACE General or ATAR or equivalent (minimum C Grades) or Certificate III,Normal,No
